sentence,features
"It's important to verify the most up-to-date information by checking official announcements from YouTube, Spotify, and Apple regarding their compatibility and support for different devices and technologies.",technology
"Companies may provide updates, make new partnerships, or announce changes in support over time.",technology
What impact do you think Apple's Vision Pro will have on the movie industry?,technology
"Apple's Vision Pro, also known as ProRes RAW, is a new video codec that allows for high-quality video capture with more flexibility in post-production.",technology
"It has the potential to have a significant impact on the movie industry, as it could change the way filmmakers capture and work with footage.",technology
"One of the key benefits of ProRes RAW is that it allows for greater flexibility in color grading, which is the process of adjusting the colors and tones of footage to achieve a desired look.",technology
"With ProRes RAW, filmmakers can make more precise adjustments to things such as exposure, saturation, and contrast, without degrading the quality of the footage.",technology
"This could lead to more creative freedom in post-production, and potentially even change the way movies are visually styled.",technology
Another potential impact of ProRes RAW is that it could make high-quality video capture more accessible to a wider range of filmmakers.,technology
"The codec is compatible with a range of cameras, including some that are relatively affordable, which could democratize the production of high-quality video content.",technology
"Overall, it is difficult to predict exactly how much of an impact ProRes RAW will have on the movie industry, but it certainly has the potential to be a significant development that changes the way movies are made.",technology
"If the health of our eyes is not at risk, what would be the best strategy for Apple Vision Pro?",vision
The health of your eyes is not a risk using an Apple Vision Pro.,vision
The only related issue is the possible need to have a prescription set of Zeiss corrective lens made for $150 for use with a Vision Pro.,vision
What kind of games will be available on the Apple Vision Pro headset?,technology
"No one will really know until it is brought to market by Apple! The announcement during WWDC was made to encourage developers to create compatible apps, that announcement was just 5 days ago!",technology
"Who thinks the Apple Vision Pro headset (at $3,400+) is viable?",price
Tim Cook must be desperate.We wont know until the end of next year to see how many people will be curious enough to pay that kind of money.,price
"ItÄôs an impressive piece of technology, but I think the price needs to go down and battery life should go way up before this will be wanted by the mass, so it might take a bit longer.",price
"If any company can afford to play the long game, itÄôs Tim CookÄôs one, who of course has every reason to be desperate:
https://www.statista.com/statistics/265125/total-net-sales-of-apple-since-2004/#:~:text=Apple's%20total%20net%20sales%20amounted,in%20the%20last%20ten%20years.",price
Edit: Interesting first review by Marques Brownlee:,price
What are your predictions for the success of Apple's Vision Pro headset in the market?,general
1.,general
Strong Brand Power: Apple has a proven track record of creating successful products and has a strong brand reputation.,general
"This can give the Vision Pro headset an advantage in the market, as customers often associate Apple with quality and innovation.",general
2.,general
"Advanced Technology: If Apple's Vision Pro headset incorporates cutting-edge features such as high-resolution displays, immersive AR/VR capabilities, and intuitive user interfaces, it could attract tech enthusiasts and early adopters who are eager to experience the latest innovations.",general
3.,general
"Ecosystem Integration: Apple has a well-established ecosystem with a range of devices and services, including iPhones, iPads, and the App Store.",general
"If the Vision Pro headset seamlessly integrates with this ecosystem, offering a seamless user experience and access to a wide range of compatible apps, it could be a significant selling point.",general
4.,general
Design and Aesthetics: Apple is known for its sleek and visually appealing designs.,general
"If the Vision Pro headset follows this trend, combining style with comfort and ergonomics, it could attract consumers who prioritize both functionality and aesthetics.",general
5.,general
Pricing and Market Competition: The success of the Vision Pro headset will also depend on its pricing strategy.,general
"If Apple manages to offer a competitive price point compared to other VR/AR headsets in the market, it could capture a larger market share.",general
"However, if the pricing is significantly higher than its competitors, it may limit its appeal to a niche market.",general
"Please note that these predictions are speculative, and actual market success can depend on numerous factors, including the final product's features, pricing, consumer demand, competition, and market trends.",general
What are some possible future software integrations for the Apple Vision Pro?,technology
Certainly! The Apple Vision Pro is an exciting platform with unique capabilities.,technology
"LetÄôs explore some potential future software integrations:
Spatial Apps: Apple has announced more than 600 new apps specifically designed for the Vision Pro.",technology
"These spatial apps leverage the headsetÄôs infinite canvas and three-dimensional user interface, allowing users to navigate with their eyes, hands, and voice.",technology
"These apps can transform any room into a personal theater, enhance collaboration, and create immersive gameplay environments.",technology
PGA TOUR Vision: Sports enthusiasts can enjoy an unparalleled viewing experience with apps like PGA TOUR Vision.,technology
"This app combines real-time shot tracking with 3D models of golf courses, leaderboards, scorecards, schedules, and other tournament details.",technology
Users can virtually step onto iconic golf courses like Pebble Beach and TPC Sawgrass.,technology
"Mac Integration: Vision Pro users can pair a Magic Keyboard and Magic Trackpad, or even bring the powerful capabilities of a Mac into Vision Pro using Mac Virtual Display.",technology
This integration creates the ultimate workspace for productivity and multitasking.,technology
"Industry-Specific Apps: Developers are exploring various industries, including design, construction, and immersive experiences.",technology
"For example, Navisworks and Revit could take advantage of Vision ProÄôs spatial computing capabilities to enhance virtual reality (VR) and augmented reality (AR) experiences.",technology
"Third-Party 3D Apps: Ahead of Vision ProÄôs launch, Apple released the visionOS software development kit (SDK) to developers.",technology
This encourages the creation of unparalleled 3D experiences.,technology
Previews of 3D apps and games designed for Vision Pro are already showcasing its powerful capabilities.,technology
Deep XR Framework: Apple integrates various XR frameworks to power Vision Pro.,technology
These frameworks empower immersive experiences and contribute to the headsetÄôs future growth.,technology
"In summary, the Apple Vision Pro is poised to revolutionize entertainment, productivity, and collaboration through its innovative software ecosystem.",technology
"Developers are pushing the boundaries of spatial computing, and we canÄôt wait to see what they create next!",technology
How does the Apple Vision Pro VR headset compare to other headsets like the Meta Quest 3?,general
"Both Apple Vision Pro and Meta Quest 3 are exciting entries in the mixed reality (MR) space, but cater to different user needs and offer distinct features.",general
"Here's a breakdown of their key differences:
Focus:
Apple Vision Pro: Leans towards professional and productivity applications with advanced eye and hand tracking for natural interaction and high-resolution displays for detailed work.",general
Meta Quest 3: Primarily targets gaming and entertainment with a wider field of view for immersive experiences and readily available gaming content.,general
"Display:
Apple Vision Pro: Boasts superior micro OLED displays with higher resolution and pixel density, potentially offering sharper visuals and richer colors.",general
"Meta Quest 3: Employs upgraded LCD panels with a wider field of view, creating a more expansive virtual environment.",general
"Input and Interaction:
Apple Vision Pro: Eliminates controllers with advanced eye and hand tracking, potentially offering a more intuitive and natural interaction experience.",general
"Meta Quest 3: Relies on physical controllers for precise and tactile feedback, ideal for fast-paced gaming and complex interactions.",general
"Software and Content:
Apple Vision Pro: VisionOS promises a unique 3D interface designed for eye, hand, and voice control, but the app library is still evolving.",general
"Meta Quest 3: Benefits from an existing and mature ecosystem of VR games and apps, readily available for diverse entertainment and experiences.",general
"Connectivity:
Apple Vision Pro: Employs faster Wi-Fi 6E for smoother online experiences, suitable for professional applications.",general
"Meta Quest 3: Offers standalone mode without relying on a PC or external device, convenient for casual use and portability.",general
"Price:
Apple Vision Pro: Carries a premium price tag targeting early adopters and professionals.",general
"Meta Quest 3: Likely to be more affordable, appealing to a wider audience.",general
"Considerations:
Apple Vision Pro: Early technology, limited content library, potentially better suited for professional uses and those willing to pay a premium for cutting-edge tech i like Vision Pro because its More Productive.",general
"Meta Quest 3: Established platform, vast content library, ideal for casual users and gamers seeking an immersive entertainment experience.",general
To become obsolete.,vision
On screen 3D viewing technology without wearing special glasses is around the corner.,vision
Wearing googles for hours is ridiculous to me.,vision
Holding my arms out in front of me like Tony Stark in Iron Man would cause arm strain in short order.,vision
I think the tech is over hyped and not thought though by many consumers that envision its alleged usefulness.,vision
How do you think wearable devices like Apple's Vision Pro will continue to evolve in the future?,technology
Sure.,technology
Apple Vision Pro is a mixed reality headset (a headset that combines virtual reality and augmented reality) developed by Apple.,technology
It was announced at the 2023 Worldwide Developers Conference and is set to be released in early 2024.,technology
"Vision Pro features a high-resolution display, eye tracking, hand tracking, and spatial audio.",technology
"It will be able to run a variety of apps, including games, productivity apps, and social apps.",technology
"Vision Pro is seen as a major new product for Apple, and it could have a significant impact on the mixed reality market.",technology
"Here are some of the things you can do with Vision Pro:
Play games: Vision Pro will be able to run a variety of games, including both traditional games and new games that take advantage of its mixed reality capabilities.",technology
"Create content: Vision Pro will be able to be used to create content, such as 3D models, videos, and photos.",technology
"Work: Vision Pro can be used for productivity tasks, such as browsing the web, writing emails, and creating presentations.",technology
"Connect with others: Vision Pro can be used to connect with others in virtual reality, such as for gaming, socialising, and education.",technology
"If you know about more Apple product then you can visit our official website
Apple
Products Reviews, Problems & Solutions - ExitCentre
Overall, Vision Pro is a powerful new device that has the potential to revolutionize the way we interact with technology.",technology
"What are some common challenges users face when creating their Apple Vision Pro Persona, and how can they overcome them?",technology
Clarity of Purpose: Users may struggle to define the specific purpose and goals of their Apple Vision Pro Persona.,technology
"To overcome this challenge, they should clearly outline the intended use case, target audience, and desired outcomes of the persona.",technology
Conducting thorough research and brainstorming sessions can help clarify the persona's purpose and ensure alignment with business objectives.,technology
"Data Collection and Analysis: Gathering relevant data to inform the persona creation process can be challenging, especially if users have limited access to customer insights or behavioral data.",technology
"To address this challenge, users can leverage various sources of data, such as customer surveys, interviews, social media analytics, and market research reports.",technology
"Analyzing this data to identify patterns, preferences, and pain points can provide valuable insights for persona development.",technology
Persona Design and Representation: Designing a visually appealing and user-friendly Apple Vision Pro Persona may require graphic design skills and software expertise that some users may lack.,technology
"To overcome this challenge, users can explore pre-designed templates or seek assistance from graphic designers or UX/UI professionals.",technology
"Additionally, using Apple's built-in design tools and resources can simplify the persona creation process and ensure consistency with Apple's design guidelines.",technology
Integration with Apple Ecosystem: Ensuring seamless integration of the Apple Vision Pro Persona with other Apple ecosystem products and services can be complex.,technology
Users should carefully consider compatibility and interoperability requirements when designing the persona and selecting features and functionalities.,technology
Collaborating with Apple developers and leveraging available APIs and SDKs can facilitate integration and enhance the persona's functionality and usability.,technology
User Testing and Iteration: Validating the effectiveness and usability of the Apple Vision Pro Persona through user testing and feedback is essential but can pose logistical challenges.,technology
Users should prioritize usability testing and iteration cycles to refine the persona based on real user feedback and behavior.,technology
"Conducting A/B testing, usability studies, and prototype evaluations can help identify areas for improvement and optimize the persona's performance over time.",technology
What is the significance of Apple's Vision Pro headset and how does it differ from other augmented reality devices?,technology
Apple's Vision Pro headset has not been officially announced or released.,technology
"Therefore, I cannot provide specific details about its features, capabilities, or how it differs from other augmented reality (AR) devices.",technology
"However, I can provide some general insights on the significance and potential differentiation of an Apple AR headset based on industry trends and Apple's past innovations:
Apple's Design and Integration: Apple is known for its emphasis on design and seamless integration across its product ecosystem.",technology
"The Vision Pro headset may prioritize aesthetics, user comfort, and an intuitive interface, leveraging Apple's design expertise to deliver a visually appealing and user-friendly AR experience.",technology
"Ecosystem Integration: Apple has a vast ecosystem of devices, software, and services, including iPhones, iPads, Macs, and various apps.",technology
"The Vision Pro headset could potentially leverage this ecosystem, allowing users to seamlessly connect and interact with their existing Apple devices and applications, creating a cohesive and integrated AR experience.",technology
Content and App Ecosystem: Apple has a strong track record in cultivating a thriving app ecosystem.,technology
"The Vision Pro headset may benefit from a robust selection of AR applications, including games, productivity tools, educational content, and more.",technology
Apple's focus on encouraging developers to create innovative AR experiences could enhance the headset's appeal and usefulness.,technology
"Hardware and Performance: Apple is known for its hardware capabilities, including powerful processors and high-resolution displays.",technology
"The Vision Pro headset might feature advanced hardware specifications to deliver smooth and immersive AR experiences, potentially surpassing the performance of other AR devices on the market.",technology
Privacy and Security: Apple places a strong emphasis on user privacy and security.,technology
"The Vision Pro headset may incorporate privacy-focused features, such as secure facial recognition, data encryption, and user consent controls, to ensure a safe and private AR experience.",technology
It's important to note that the above points are speculative and based on Apple's general approach to product development and its reputation in the industry.,technology
"Until Apple officially releases details about the Vision Pro headset, it is difficult to provide precise information on its significance or how it differentiates from other AR devices.",technology
"How useful is Apple Vision Pro in car repair, jet engine maintenance, and the entire gamut of complex machinery?",technology
In all reality it just depends on the person.,general
I personally would love to use virtual reality as a learning tool because it would be like learning hands on like if I was right there and they were showing me how to do things up close and personal but that works for me that how I prefer to learn things it would be way better than watching how to videos that you have to constantly pause or reverse and watch it again and again cuz you missed something important it's not like you can ask them questions with virtual reality you'd be able to ask questions and get answers for a better understanding of what you're trying to learn.,general
As for the complex machinery I think that would be so helpful to be able to take something apart and understand how it works and functions before you actually work on your stuff this way if you mess up your not ruining the real thing I love taking things apart to see how they work.,general
When I was a kid I used to take things apart and forget how to put it back together or id forget to put it back together my parents would get so mad.lol Then when I got older who did they call when something broke?,general
Yeah me.,general
I used to have the oculus it's similar to that apple vision pro I think their on to something in reference to using virtual reality as a learning tool however I wouldn't want my children to get lost in a fantasy world for hours on end like playing video games all the time or watching TV shows that send the wrong messages .,general
I'm down if it's educational other than that I'm kinda skeptical about it.,general
Why is the accessibility story of Apple's Vision Pro headset important and worthy of attention?,general
"Apple had not released a product called ""Vision Pro headset."" Therefore, I don't have specific information about this product or its accessibility features.",general
It's possible that new products or updates have been released since then.,general
"However, I can provide a general perspective on why the accessibility story of any technology product, especially from a major company like Apple, is important and worthy of attention:
Inclusivity: Accessibility features in technology products are designed to make them usable and enjoyable by a broader range of people, including individuals with disabilities.",general
"When a major company like Apple incorporates robust accessibility features into their products, it signals a commitment to inclusivity and ensures that their technology is accessible to as many users as possible.",general
Empowerment: Accessible technology can empower individuals with disabilities by providing them with tools and functionalities that cater to their unique needs.,general
"This empowerment can lead to increased independence, productivity, and participation in various aspects of life.",general
Awareness and Education: High-profile products like those from Apple can help raise awareness about the importance of accessibility and the needs of people with disabilities.,general
It encourages other companies to follow suit and consider accessibility as a fundamental aspect of their product development.,general
"Impact on the Industry: When major tech companies prioritize accessibility, it can have a significant impact on the industry.",general
It sets higher standards and encourages other companies to invest in research and development to create more inclusive technology solutions.,general
"Social Responsibility: Technology companies, especially large ones with a global reach, have a social responsibility to ensure that their products are accessible to all users.",general
"By incorporating accessibility features, they demonstrate their commitment to social responsibility and contributing positively to society.",general
"Future-Proofing: As the population ages, the need for accessible technology is likely to increase.",general
"By incorporating accessibility features early on, companies like Apple can future-proof their products and ensure their relevance in a more diverse and aging user base.",general
"Overall, the accessibility story of any technology product, including those from major companies like Apple, is important because it emphasizes the need to design technology with all users in mind.",general
It highlights the potential of technology to create a more inclusive and equitable world where everyone can fully participate in the digital age.,general
What did Mark Zuckerberg criticize about Apple's Vision Pro headset?,general
"Mark has said few points about Apple Vision Pro:
1: Vision pro is 7 times costlier than Meta VR product
2: Vision Pro is not social and every demo showcased a person sitting on couch
3: Vision Pro innovations have been thought by MetA however, Meta has decided to go what they dreamed off usecases by making trade-offs",general
Do you think the clunky design of Apple's Vision Pro headset is the main reason for the discomfort reported by users?,headset
"Not really, I think the issue is when you have two pounds of stuff strapped to your face that mostly needs to be directly in front of your eyes it is inherently not exactly the most comfortable item you will wear.",headset
"It is surprisingly comfy for two pounds, but that is a bit like admiring the dancing bearÄôs talentÄ¶",headset
How will technologies like Apple's Vision Pro change the gig economy?,technology
"Apple's Vision Pro, with its advanced object and scene recognition capabilities, has the potential to impact the gig economy in various ways, though the extent and specific impacts remain to be seen.",technology
"Here are some potential changes:
Increased Efficiency and Automation:
Task completion and verification: Vision Pro could automate task",technology
How might production forecast cuts for Apple's Vision Pro mixed-reality headset impact its market value?,general
I can provide some general insights on how production forecast cuts for a product like Apple's Vision Pro mixed-reality headset could potentially impact its market value.,general
"Investor Sentiment: Production forecast cuts may lead to negative investor sentiment, as it can be interpreted as a lack of confidence in the product's market demand or supply chain challenges.",general
This could result in a decrease in the stock price as investors may sell their shares.,general
Revenue Expectations: Production forecast cuts imply lower anticipated sales volume.,general
"If the Vision Pro headset was expected to contribute significantly to Apple's revenue, a reduction in sales expectations may lead to a decrease in the company's overall revenue projections, potentially affecting its market value.",general
"Competitive Landscape: If production forecast cuts are due to increased competition or market challenges, it could impact Apple's market position.",general
"Competitors' success in the mixed-reality headset space could lead to a perceived loss of market share for Apple, potentially affecting investor confidence and market value.",general
"Product Perception: Reduced production forecasts might raise concerns about the product's performance, demand, or potential issues.",general
"If consumers perceive the cuts as indicative of a less desirable product, it could impact market adoption and overall sales.",general
"It's important to note that various factors beyond production forecast cuts can influence a company's market value, including overall market conditions, financial performance, product portfolio, and investor sentiment.",general
"Detailed analysis of financial statements, market trends, and company announcements would be necessary to assess the specific impact on Apple's market value in such a scenario.",general
"Why do Walmart, Nike, Vanguard, Stryker, Bloomberg, and SAP use Apple's Vision Pro headset in their businesses?",technology
"Walmart, Nike, Vanguard, Stryker, Bloomberg, and SAP are all major companies with diverse business operations, yet they all have one thing in common - they have incorporated Apple's Vision Pro headset into their daily operations.",technology
But why have these companies chosen to use this particular headset?,technology
One of the main reasons is the advanced technology and features that the Apple Vision Pro offers.,technology
