,title,content
0,What do you think of the Apple Vision Pro?,"Just today — the day of release — I was one of the first members of the public to experience the Apple Vision Pro demo.
Purely by accident.
Whatever you know or think you know about this … get ready to be run over.
I came into the Apple store without an appointment with an iPad that wouldn’t charge. There were no plans to be impressed by anything. I left with a glimpse into the future.
What am I going to do? I asked the salesman that because I was so excited by what I experienced and realized I could never, ever explain it to anyone.
He smiled.
“I know.”
Have you seen IMAX? Not the fakey digital knockoff, but the original gigapixel version on 70mm film? Well, there was actually a more ambitious predecessor called OMNIMAX that was shown only in special spherical theaters. Though it completely filled your entire vision field, it didn’t work perfectly. There was all kinds of distortion from the mismatch of the screen’s and the camera lenses’ curvatures, plus the imperfections of projected film.
Imagine OMNIMAX with digital perfection, 4K resolution, and true 3-D. And without six figures’ worth of projector and screen. Just a headset.
One clip of a baseball game was felt like i was actually on my stomach on the dirt watching home plate. Another shot of a tropical beach looked as if I could step right onto the ground below me. You look down, there’s the dirt. Look up — sky. Just like reality.
This is real, honest, true, no-BS virtual reality.
Really.
But that’s “just” the razzle and dazzle.
What about everyday utility?
I feel as though no one ever mentioned this, but … this could be your computer screen. I love my iPad, and use it for everything that most use a PC for — even writing articles and doing taxes. I love the convenience and simplicity of it — no mouse or extra gear, always ready to go with no boot-up. But … the fact that it’s handheld makes it too close to my eyes. After years of this, I’m seeing double. How can I get a screen a little farther away and still have control with just my hands (no pointing device)?
Vision Pro looks like the answer.
The large virtual screen is about 3 feet away (seems like you could just reach right out and touch it), conveniently located right in front of you, and just the size you want. You point with your eyes (yep, it follows that) and “click” with your fingers — wherever they are. You navigate with your eyes and fingers, stretch and zoom. Just like on an iPad, except instead of on glass you do it in virtual space.
At the end, the salesman asked what I thought.
“I want it.”
He smiled.
“I know. I want it too.”"
1,How does Apple Vision Pro work?,"Apple Vision Pro: Unveiling the Myths and Realities
Amidst the ever-changing landscape of technology, Apple's Vision Pro stands as a beacon of innovation, promising to revolutionize the way we interact with the digital world. However, separating the myths from the facts surrounding this highly anticipated device is crucial to understanding its true potential and impact on Apple's trajectory.
Myth: The Vision Pro Will Drive Apple's Immediate Success
Despite Tim Cook's enthusiastic portrayal of the Vision Pro as a ""revolutionary device,"" analysts predict a more gradual rise in its revenue contribution. Morgan Stanley estimates that the Vision Pro may reach a maximum of $4 billion in revenue by 2027, a far cry from Apple's current quarterly revenue of $119.58 billion.
The Vision Pro's full potential lies in the distant future, with its mature, mass-market version not expected until 2030 or beyond. This long gestation period raises concerns about its immediate impact on Apple's bottom line, mirroring the challenges faced by Meta's Reality Labs.
Fact: Apple's China Conundrum
Apple's heavy reliance on China, with approximately 20% of its iPhone revenue originating from the country, has become a double-edged sword. While China presents a lucrative market, the growing popularity of domestic Chinese phone brands is eroding Apple's dominance.
In the most recent quarter, Apple's sales in Greater China plummeted by nearly 13%, marking its only region with declining sales. This setback, coupled with Apple's projected revenue decline in the upcoming quarter, highlights the urgency of addressing this challenge.
first gen product. wait for it.👆🏻
Fact: Google's Cultural Overhaul
Google's recent earnings call revealed a candid acknowledgment of the need for cultural transformation. President Ruth Porat emphasized the company's focus on ""removing layers to simplify execution and drive velocity,"" signaling a shift towards greater efficiency and agility.
This introspection and willingness to address internal issues demonstrate Google's commitment to overcoming its perceived slowness and fostering a more dynamic work environment.
Myth: Digital Advertising's Demise
Contrary to popular belief, the digital advertising industry is not in decline. While certain segments may be experiencing challenges, the overall trend indicates continued growth.
Google's advertising revenue, for instance, grew by 7% year-over-year in the fourth quarter of 2022, despite broader economic uncertainties. This resilience underscores the enduring importance of digital advertising as a revenue stream for tech giants.
Conclusion: Navigating the Tech Labyrinth
In the midst of flux and uncertainty, discerning the truth from the noise in the tech industry is paramount. By examining the myths and facts surrounding Apple's Vision Pro, China's impact on Apple, Google's cultural transformation, and the state of digital advertising, we gain a clearer understanding of the challenges and opportunities that lie ahead for these tech behemoths.
If you enjoyed this answer
Kindly upvote and follow my space ""Defi Club"" for more exciting DeFi insights & general learnings like this😉."
2,What are your thoughts on the Apple Vision Pro headset?,"* It is stunning.
* It is a technological marvel almost beyond imagination.
* It is the future.
* But is not for everyone. Not for most people. Not for many people. Not, in fact, for almost anyone.
Let me explain:
I have been putting the Vision Pro through its paces for the past 24 hours, and it is clear that it is bringing the future into the present. It is also clear that it is literally an order of magnitude more advanced than any other AR/VR product ever developed.
It is instantly reminiscent of the Apple ][ with VisiCalc, the Mac, the iPod, the iPhone, the iPad, and even the Apple Watch when they were introduced. Each of these broke completely new ground in bringing frontier technology to the masses, redefined our interface with technology, were under-featured, over-priced, and required patience to deal with unfamiliar new interfaces and limited applications.
Just as I was the first person in my entire family to get a computer and an iPhone, and am still the only person in the family with an Apple Watch and iPad, I will clearly be the only one with a Vision Pro for the next year or so. It’s too new fangled for my father’s generation, too fiddly and intrusive and inconvenient for my generation, and too expensive for the next generation. But for me and those of my ilk (“tech enthusiasts” and a very few “early adopters”) who can afford it, the Vision Pro is like taking a jump 5–10 years into the future.
Until now the prevalent approach to immersive visual computing and gaming has been Virtual Reality, replacing the live image your eyes see with a computer generated image—either realistic or not. In recent years, and with the explosion of smartphones that include high resolution cameras, displays, and computing power, there has been an increase in Augmented Reality, overlaying computer generated images to interact with live images, for things like navigation directions and furniture placement. While both MagicLeap and Microsoft with HoloLens have attempted to create AR-based devices, neither has met with much in the way of consumer acceptance, nor even business use cases (other than a military contract for HoloLens).
Whereas the technology involved in Apple’s previous product launches was generally the best of what was currently available put into a consumer friendly format, the Vision Pro is all that…plus introducing an insane collection of raw technological advances, overlaid (literally) onto a worldview that is fundamentally different from what the incumbent market players have done so far.. With the Vision Pro, Apple has done what it inarguably does better than any other organization on the planet: deliver best of breed hardware and an elegant, cohesive, comprehensive, operating system that integrates with everything else that Apple produces or sells. In this case, Apple is taking Spatial Computing mainstream. There simply is no comparison between the Vision Pro and the earlier MagicLeap and HoloLens offerings.
The apps and demos available at launch are, in many cases, mind-blowing, what James Cameron declared to be “a religious experience”. Watching films in Apple’s new Immersive Video (180 degree, 8k, 3D) is like nothing you have ever seen. Seeing planes landing and taking off from an airport in realtime 3D gives you a peek into what the future will be, and FaceTiming with multiple people in your own living room is not just a feature, it’s a whole new application. Unlike the compromises necessary with existing AR attempts, Apple’s insanely high resolution cameras and displays, combined with its powerful Apple silicon chips, delivers on the promise of true spatial computing in your own real world environment.
But since only a few million people (max!) will use this over the next several years (compared to billions with smartphones), he truly important thing about the Vision Pro has nothing to do with its groundbreaking hardware, and nothing to do with the thousands of “compatible” iPad apps it can run. Instead, the best analogy for the Vision Pro is…Uber.
Think about what Uber has done over the past decade: they have created an insanely powerful, comprehensive, ubiquitous, seamless, system that will trans..."
3,What is the main purpose of Apple Vision Pro?,"Apple envisions the Vision Pro as a trailblazing entry into a ""new era of spatial computing."" As a standalone wearable computer, its primary aim is to revolutionize various experiences, such as watching TV, working, reliving digital memories, and enabling remote collaborations, especially in apps like FaceTime.
Despite its ambitious goals, the specific 'point' or singular purpose of the Vision Pro is still evolving. At launch, it will offer functionalities like providing a large, portable monitor for Apple laptops and creating a captivating cinematic experience in apps like Disney Plus. However, much like the early days of the Apple Watch, the full potential of the Vision Pro will be shaped by developers and users, who will define the groundbreaking use cases that truly set it apart."
4,What is Apple's Vision Pro?,"The Vision Pro marks Apple's significant entry into a new product category after an eight-year gap. It introduces a revolutionary type of headset that offers unique control capabilities through the wearer's eyes, hands, and voice – a key differentiator not found in other headsets. Apple CEO Tim Cook referred to it as the company's first product that you ""look through"" rather than ""look at,"" highlighting its groundbreaking concept of ""spatial computing"" and the addition of a new dimension to the world of powerful personal technology."
5,Do you think the Apple Vision Pro headset will succeed?,"No, this will be Tim Cook's Waterloo and will lead to a change in Apple's CEO. They need a ""right-brained"" leader who can adapt to the AI era.
Jobs invented a money-making tool, and Tim Cook made a lot of money by continuously using it, which made many people think he was strong. But in reality, he's just an operator of the machine. He stole Jobs' credit.
So, in order to prove himself and cover up his mistakes, he launched Vision Pro. But this will only expose his problems more prominently. So he will definitely take more measures to hide the errors, but that will lead to more mistakes. People often say that mistakes require more mistakes to cover up. We will see these issues within Apple.
Therefore, for smart people inside Apple, their best choice is to stay as far away from this project as possible, and it's wise to find a way to escape before the failure. This will ultimately impact the stock price. And Tim Cook is a stock price CEO. His position depends on the stock price.
If this happens, it could happen as early as 2024, the best possible successor at the moment is Elon Musk, provided he is willing."
6,What is this Apple Vision Pro?,It’s a Vr and Ar product newly launched by Apple . It’s going to be a game changer for Apple like the iPhone . Seeing the growing use of Virtusl and augmented technologies Apple has stepped in to carve a niche for itself in this arena
7,How can I earn money making apps for Apple Vision Pro?,"If you want to earn money by making apps for Apple's Vision Pro, there are a few steps you can take:
1. Learn the basics of app development: Before you can start making apps for Apple's Vision Pro, you need to have a solid understanding of app development. You can learn the basics of app development by taking online courses, attending workshops, or reading books on the subject.
2. Get familiar with Apple's Vision Pro: In order to develop apps for Apple's Vision Pro, you need to be familiar with the platform and its capabilities. You can learn more about Vision Pro by reading Apple's documentation and developer resources.
3. Create a portfolio of apps: Once you have a solid understanding of app development and are familiar with Vision Pro, you can start creating your own apps. Create a portfolio of apps that showcase your skills and demonstrate your ability to create high-quality apps.
4. Publish your apps on the App Store: Once you have created your apps, you can publish them on the App Store. This is where users can download and use your apps, and where you can earn money through in-app purchases, subscriptions, or advertising.
5. Promote your apps: In order to make money from your apps, you need to promote them to potential users. You can promote your apps through social media, online advertising, and other marketing channels.
6. Continuously update and improve your apps: To keep users engaged and interested in your apps, you need to continuously update and improve them. This will help you retain users and attract new ones, which can lead to more revenue over time."
8,Can Apple's Vision Pro succeed when Google Glass failed?,"Apple has sold out of the initial run - and did so on immediately.
So that’s something of a success already.
Apple is offering a best in class product which is doing two different things.
1) Offering a very compelling entertainment experience. A device for consuming movies and immersive content.
2) Making the claim that it is also a productivity tool. A place to get work done.
The entertainment offering seems very strong. The company seems to have refined the launch product to a point where reviewers are blown away by the immersive stuff.
The productivity claim, is to me a bit less convincing. I am certain that the company have done a great job with the user interface and the apps. I am just not entirely certain that everyone would want to do work in a virtual space - if that entails wearing a big-old headset for long periods. I am personally more productive with fewer windows and a single-tasking interface. A cloud of floating windows clamouring for my attention is not something beneficial so someone who has an attention deficit.
This product is generation one: a flag in the sand. A statement of intent. If first adopters respond well, then there will be later products which will build upon it. These future products will become…
Cheaper. The “pro” suffix already suggests a non-pro offering.
Better. In terms of their visual fidelity
Lighter/thinner less intrusive. - It’s this last one which I think matters a great deal. For truly mass adoption and use in a workplace, the product will need to become much less obtrusive. Ideally becoming almost invisible.
If the company delivers on all three, then their idea of a visual computing device will succeed. Perhaps not to the same extent as the iPhone. But significant enough to be another substantial platform.
Google Glass was a technology demo which didn’t offer utility to anyone."
9,Can a dog use Apple Vision Pro?,No. And can’t buy one either. I dare anyone to buy on for their dog and train the dog to use it.
10,How does Apple Vision Pro understand hand gestures from various positions?,"Apple Vision Pro, as of my knowledge cutoff in September 2021, is not a specific technology or product developed by Apple. However, Apple has various technologies and frameworks, such as Core ML and Vision, that enable developers to incorporate machine learning and computer vision capabilities into their applications.
Understanding hand gestures from various positions typically involves a combination of computer vision techniques and machine learning algorithms. Here's a general overview of how such systems can work:
Data collection: To train a machine learning model to recognize hand gestures, a large dataset of hand images or videos from various positions and angles needs to be collected. This dataset is usually labeled with corresponding gestures.
Feature extraction: Computer vision techniques are applied to extract relevant features from the collected hand images or videos. These features can include the position, orientation, shape, size, and movement of the hands, as well as the relative positions of the fingers.
Training a model: Machine learning algorithms, such as convolutional neural networks (CNNs), are trained on the collected dataset. The extracted features from the previous step are used as input to the model, which learns to recognize patterns and associations between the input features and the corresponding hand gestures.
Testing and evaluation: After training, the model is tested on a separate dataset to assess its performance. This evaluation helps determine the accuracy and effectiveness of the model in recognizing hand gestures from various positions.
Real-time recognition: Once the model is trained and evaluated, it can be integrated into an application or system. In real-time, the system captures video or image input from a camera or other sensors. The captured input is then processed using the trained model, which recognizes and interprets the hand gestures based on the learned patterns and associations.
It's important to note that Apple may have developed proprietary technologies or frameworks since my knowledge cutoff that enhance hand gesture recognition or provide specialized tools for developers. Therefore, for the most accurate and up-to-date information on Apple's hand gesture recognition capabilities, I recommend referring to Apple's official documentation or announcements."
11,Will Apple's Vision Pro replace the flat-screen TV?,"No. Absolutely not.
For one thing, television-watching on a large-screen TV is a group activity. The Vision Pro is not.
Will the Vision Pro replace personal computer monitors?
Also no.
Even if that is what Apple first focussed on when we were first introduced to it.
(note, this section is copied and pasted from another of my answers)
Personal computing, and computing in general, goes through periodic step-changes each time the user interface changes.
We went from teletype and the command line to the GUI and the mouse. That made computing more accessible and it made us an order of magnitude more productive. I like to think of this as going from a one-dimensional interface to a two dimensional interface.
Bear in mind, GUI didn’t make the command line obsolete - it still exists. I literally use one every day. Still. In 2024. But far more of the tasks that we do use the GUI and far fewer people need to, or choose, to use the command line.
We went from a GUI with a mouse to touchscreens. This too made computing more accessible to more people, and made us more productive. I consider this going from a two-dimensional to two-and-a-half-dimensional interface.
Like with the GUI, touch didn’t make desktop computing obsolete - it still exists. But far more of the day to day tasks that we do use a touch device and far fewer people need to, or choose to, use a desktop.
I believe that the next two step-changes in computer interfaces are voice (like Alexa and Siri) in one direction (back to a one-dimensional interface), and a rich immersive three-dimensional interface in the other direction.
It’s not new. AR and VR have been around for some time now and pretty-much confined to being a novelty. Gaming is by far the most suitable application currently, and yet AR/VR is still a tiny proportion of the gaming market.
But, I believe, immersive 3D will become the user interface norm for General Computing.
Yes, I believe that we will achieve a productivity boost from Excel going immersive. Well, maybe not exactly Microsoft Excel, but normal computing applications. Once we eventually get through the novelty and gimmicks, and an uncanny valley of skeuomorphism that immersive 3D user interface will inevitably bring.
It’s hard to tell how and when immersive 3D interfaces will be used for general computing, but if anyone can give it a nudge in the right direction, it’ll be Apple.
For AR/VR to be a serious platform, it needs better content and software. And, most of all, the development tools for applications developers.
Developing apps for an immersive platform is still very much like game development. Each game development engine (e.g Unity, Unreal etc.) has its own toolkit of UI elements, and they are very gamey, not necessarily suitable for general applications.
There are some nascent web standards to allow AR and VR content on the web. And they are still a little clunky to use. Until we have the equivalent of Bootstrap for AR/VR, not much is going to change
As Apple enters this space, they have the potential to change it from a niche industry to mainstream computing.
With the Vision Pro, Apple is bringing a device. Sure, it’s expensive. And it’s at least as cumbersome as the others already out there. But it’s a start.
From day one, Apple can come with the content. All the major blockbuster films of the last ten to fifteen years have been released in 3D. They have the iTunes Store and their ties to major studios, and their AppleTV+ service with the power to commission new content. They have just gone through a lot of effort to get music producers to move to spatial audio for Apple Music, you can see them influencing video content creators in a similar way.
Apple can bring the content creation tools. At the consumer end, iPhones already have stereoscopic cameras, so like we went from still photos to live photos, every picture or video we take could be a 3D one. Then they have the iMovie and Final Cut software to edit and put them together.
Apple can bring some of the social interactions – Messages (formerly iMessage), FaceTime, AirPlay and SharePlay could form the basis of a shared experience. A space that both Meta and Microsoft have expressed serious interest in (but with little to show for it so far).
But most importantly, Apple will have the application development tools, extending the Xcode tools and already-existing APIs like ARKit to enable development of 3D and immersive applications, hopefully with a decent set of UI widgets and HCI guidelines, to allow third-party developers to make and sell AR and VR applications on the app store.
The Vision Pro is a step. The first step. I consider it an indication to developers, firstly by calling it “Pro”, that there will be a range of devices and a platform with probably, in Apple fashion, yearly hardware updates. And by calling it VisionOS, also an indication that this is a viable platform from the same stable as macOS, iOS, iPadOS etc. (with lots of commonality) and will also most likely have yearly system updates. And the same set of developer APIs and tools they are already familiar with.
The Apple Vision Pro will not replace any of your existing devices. The Vision Pro will introduce early adopters to the potential of immersive three-dimensional computing."
