,title,content
130,How do you use your Mac screen inside the Apple Vision Pro?,"To use your Mac screen inside the Apple Vision Pro, you will need to connect your Mac to the Apple Vision Pro using a Thunderbolt cable. Once connected, you can access your Mac's screen through the Apple Vision Pro's display settings. This allows you to use your Mac's screen as an external display for the Apple Vision Pro, providing a larger and more immersive viewing experience.
If you want to learn more about using the Apple Vision Pro and other helpful tips and tricks for your Mac, make sure to check out the link in our bio!"
131,How can the new Apple Vision Pro that will be released soon?,"While the official release date for the Apple Vision Pro is still under wraps, rumors and leaks have painted a tantalizing picture of what could be the next game-changer in mixed reality headsets. The Apple Vision Pro is expected to come at a premium price, likely exceeding the current high-end VR headsets. It's an investment in the future of mixed reality, but one that might not be accessible to everyone."
132,What are the potential implications of Apple's Vision Pro on human interaction and relationships?,"Some of them are:
It can enhance the way people communicate, collaborate, and socialize with each other across distances. For example, users can have reimagined FaceTime calls with holographic representations of their friends and family, or work together on 3D assets in mixed reality spaces.
It can transform the way people consume and create entertainment, education, and information. For example, users can stream movies, shows, and games on an infinite canvas, or learn new skills and explore new places with immersive experiences.
It can also change the way people perceive and relate to their environment and themselves. For example, users can customize their surroundings with digital content, or capture and relive their memories in 3D."
133,How does Apple's Vision Pro compare to Meta Quest Pro in terms of innovation?,"When we look at the Apple Vision Pro and the Meta Quest Pro, we see two different approaches to virtual and augmented reality, each with its own strengths and weaknesses.
The Apple Vision Pro is a high-end headset with a hefty price tag and cutting-edge technology. It's like the luxury car of the virtual reality world. With its powerful chips and 4K resolution per eye, it aims to provide users with a top-notch immersive experience. The Vision Pro also stands out with its mixed reality capabilities, seamlessly blending virtual and real elements, along with advanced hand-tracking and eye-tracking features.
On the other hand, the Meta Quest Pro takes a more accessible approach, offering a lower-priced option with a focus on versatility and community. It's like the reliable family car that gets the job done without breaking the bank. While it may not match the Vision Pro in terms of raw power and innovation, it still delivers a decent visual experience with its Snapdragon XR2+ chip and full-color passthrough feature.
So, when it comes to innovation, the Apple Vision Pro shines with its cutting-edge technology and advanced features, setting a new standard for immersive experiences. However, the Meta Quest Pro innovates in its own way by prioritizing affordability and versatility, making virtual and augmented reality more accessible to a wider audience.
Both headsets offer innovative features and cater to different user needs and preferences. Whether you prioritize top-of-the-line technology or affordability and versatility, there's a headset out there for you.
(Images are used for demonstration purpose only and are not real images)"
134,What happens if you won’t take off Apple Vision Pro for 1 week or a month?,"Nobody knows; as of this writing it hasn’t been available that long. Why don’t you try that yourself and tell us?
(If you can’t because you don’t have one, why do you even care?)"
135,What are some exciting features of Apple's Vision Pro headset that you can't wait to try?,"However, Apple is known for its innovation in the tech industry, and if they were to release a headset focused on vision, it could potentially incorporate advanced technologies and features. Here are some speculative features that could be exciting, based on the general trends and capabilities of current virtual reality (VR) and augmented reality (AR) devices:
1. High-resolution Display: The Vision Pro headset might feature a high-resolution display, providing a crisp and immersive visual experience. Apple has a track record of utilizing high-quality displays in their devices, such as Retina displays in iPhones and iPads.
2. AR/VR Integration: The headset could offer a combination of augmented reality and virtual reality capabilities, allowing users to seamlessly transition between the real world and immersive virtual experiences. Apple has been investing in AR technology with the release of ARKit, which suggests a potential focus on AR capabilities in their future products.
3. Advanced Tracking and Sensing: The Vision Pro headset might employ advanced tracking and sensing technologies to accurately detect head movements, gestures, and spatial positioning. This would enhance the overall user experience and enable more precise interaction with virtual environments.
4. Comfort and Design: Apple prioritizes design and user experience, so the Vision Pro headset could feature a sleek, lightweight design with comfortable materials and adjustable straps. It may also incorporate intuitive controls and an ergonomic fit for extended periods of use.
5. Seamless Integration with Apple Ecosystem: Like other Apple devices, the Vision Pro headset might seamlessly integrate with the Apple ecosystem, allowing users to leverage existing apps, services, and devices. It could potentially integrate with iOS and macOS, enabling smooth interactions with iPhones, iPads, and Mac computers.
Please note that these features are purely speculative, and the actual features of any future Apple headset may differ significantly. For accurate and up-to-date information about any official Apple product releases, it's best to refer to Apple's official announcements and news sources."
136,Have you experienced any memorable moments using the Apple Vision Pro's 3D photo and video capture feature?,"My virtual reality experiment: I was driving up a 6 lane superhighway early one August afternoon in clear bright sunlight at about 65 miles per hour in my clunky Toyota Corolla DX, with no other cars on the road. I decided to look intently at the little image in the car's rear view mirror -- no high tech apparatus. I really really really really intently focused all my attention on that little image! It was entirely convincing. That ""little"" image became my whole experienced reality: I was driving where I had been, not where the automobile was going. Fortunately I ""snapped out of it"" in time to avoid becoming a one car crash in the ditch on the right side of the road. (It was a very good place to have conducted this experiment, because there was a police barracks, a teaching hospital, and both Christian and Jewish cemeteries nearby, just in case.)
You may try to repeat my virtual reality experiment at your own risk; I strongly advise you against doing so. I assure you: It worked. (Of course it will not work if you don't ""give in to it"", just like a video game won't work if you just look at the pixels as what some computer programmer coded up with branching instructions depending on what inputs you enter.) Moral of this story: VIRTUAL REALITY CAN KILL YOU. Forewarned is forearmed."
137,"What are some of the most innovative features of Apple Vision Pro, Apple's new augmented reality headset?","The new Apple Vision Pro device has features people will find a fascinating thing. However, you can read my most recent post to find out more about this Vision Pro headset.
new update: The Future is here A Deep Dive into the Apple’s New Headset"
138,Do you think Apple's Vision Pro headset will help boost the company's sales?,"The success of a product in boosting a company's sales depends on various factors, including market demand, competition, pricing, and consumer reception. If Apple's Vision Pro headset offers unique and compelling features that meet customer needs, it has the potential to contribute positively to the company's sales. Apple's strong brand and customer loyalty can also play a significant role. However, predicting the exact impact on sales requires observing market dynamics and consumer reactions over time."
139,Do you think Apple's Vision Pro will make 3D movies and TV shows more popular?,"My peculiar ocular history puts me in a good position to answer this. I had a weak right eye as a kid. My left eye was 20/60 and my right 20/200, but both correctable. I went through a lot of eye exercises to get my eyes to play nice together, but all I learned was how to select which eye I could look through. I can make a parallax shift without closing an eye. I do not have stereopsis. I can tell you that the lousy 5 cm separation between your eyes is trivial compared to the parallax clues you get from normal motion. I can catch a ball and thread needles. Lack of stereopsis has not had the slightest effect on my life, and I perceive the world as totally three dimensional.
In the last few years I had ocular implants to correct cataracts. So my eyes are pretty much equal. It has absolutely no impact on my life. I have gone to 3-D movies and, apart from a few instances where something comes right at my face, I see no difference.
I have no use whatsoever for 3-D gimmicks to put on my face and drain my wallet."
140,Should Apple's Vision Pro headset be used while operating a moving vehicle?,No it should not be. It shouldn’t be used in restaurants either. Keep your eyes open and connect with people before allowing technology to swallow your life up.
141,What do you think about the interface and various apps on the Apple Vision Pro?,"As of my last knowledge update in September 2021, there is no specific device called ""Apple Vision Pro"" in Apple's product lineup. You may be referring to a hypothetical or unreleased product. However, I can provide you with a general perspective on Apple's interface and apps based on their existing products.
Interface:
Apple is renowned for its sleek and intuitive user interfaces across its devices. Their operating system, iOS, offers a clean and visually appealing interface with easy navigation and intuitive gestures. Apple's interface design focuses on simplicity, consistency, and seamless integration between apps and features. The overall experience aims to be user-friendly, allowing users to quickly and efficiently navigate through different functionalities.
Apps:
Apple offers a wide range of apps across different categories, including productivity, communication, entertainment, creativity, and more. Some of the most popular and well-regarded apps in Apple's ecosystem include:
Messages: Apple's native messaging app, which supports text messaging, multimedia sharing, and group chats.
Safari: The default web browser for iOS, known for its speed, security, and user-friendly interface.
Notes: A versatile note-taking app that allows users to create, organize, and sync notes across their Apple devices.
Pages, Numbers, and Keynote: Apple's productivity suite, providing tools for word processing, spreadsheet management, and presentation creation.
Photos: An app that lets users organize, edit, and share their photos and videos seamlessly.
Apple Music: A music streaming service that offers a vast library of songs, personalized playlists, and curated content.
iMovie and Clips: Apps for video editing and creating fun, shareable videos.
GarageBand: A powerful app for music creation and recording, offering a range of instruments and audio editing tools.
Apple continually updates and refines its apps, introducing new features and improvements with each software release. The quality and functionality of Apple's apps generally receive positive feedback from users, emphasizing ease of use, integration with other Apple devices, and a consistent user experience.
Please note that my information is accurate up until September 2021, and Apple may have released new devices or made updates since then. For the most current and specific information on Apple products and their apps, I recommend referring to Apple's official website or contacting Apple support."
142,What are some unique and engaging gameplay experiences on the Apple Vision Pro?,"While the Apple Vision Pro is still relatively new, it packs some potential for truly unique and engaging gameplay experiences thanks to its spatial computing capabilities. Here are a few examples:
Blending the physical and virtual:
Spatial puzzles: Imagine manipulating virtual objects within your own living room, solving puzzles that integrate real-world furniture and your own physical movements.
Augmented reality adventures: Explore your neighborhood on interactive quests, battling holographic creatures or deciphering hidden clues overlaid on the real world.
Interactive sports: Throw virtual pitches in your backyard, practice basketball moves against hologram opponents, or even compete in augmented reality races with friends.
Leveraging your own body:
Mind control games: Imagine using your thoughts to control objects in the virtual world, telekinetically solving puzzles or navigating through challenging environments.
Gesture-based combat: Engage in sword fights or martial arts battles using real-world movements, feeling the impact of your strikes through haptic feedback.
Full-body dance challenges: Step onto a virtual dance floor and learn choreography by mimicking in-world avatars, with your movements translated into the game.
Creative collaboration and competition:
Co-creative world building: Imagine collaborating with friends to build virtual landscapes in your shared living room, shaping mountains, placing rivers, and constructing buildings together.
Spatial board games: Gather around a virtual table with friends, manipulating holographic game pieces and interacting with the board through gestures and voice commands.
Global AR scavenger hunts: Teams from around the world compete in augmented reality scavenger hunts, searching for hidden clues and virtual objects overlaid on real-world locations.
These are just a taste of the possibilities, and the potential for even more innovative experiences is vast. As developers adapt to the unique capabilities of the Vision Pro, we can expect even more groundbreaking gameplay mechanics to emerge.
It's worth noting that many of these concepts are still in early stages of development, and the true extent of these possibilities will depend on the creativity of developers and the adoption of the headset by the gaming community. However, the Apple Vision Pro certainly has the potential to revolutionize the way we interact with games and push the boundaries of what we consider ""gaming"" itself.
I hope this excites you about the possibilities for the Apple Vision Pro! Do you have any specific ideas for unique gameplay experiences you'd love to see on the platform?"
143,"How likely is it that Apple's Vision Pro headset will establish ""spatial computing""?","It is difficult to say for sure how likely it is that Apple's Vision Pro headset will establish ""spatial computing"". However, Apple has a strong track record of introducing new technologies that become mainstream, and the Vision Pro headset has the potential to be a major breakthrough.
Spatial computing is a new way of interacting with computers that involves blending digital content with the physical world. This can be done using a variety of technologies, including augmented reality (AR) and virtual reality (VR).
The Vision Pro headset is an AR headset, which means that it will overlay digital content on the real world. This could be used for a variety of purposes, such as gaming, navigation, and education.
Apple has not yet released any details about the specific features of the Vision Pro headset, but it is expected to be a high-end device with powerful hardware and software. This could make it a compelling option for early adopters and could help to drive the adoption of spatial computing.
However, there are also some challenges that need to be overcome before spatial computing can become mainstream. One challenge is the cost of the devices. AR and VR headsets are still relatively expensive, which could limit their appeal to the mass market.
Another challenge is the lack of content. There is not yet a wide selection of AR and VR applications available, which could make it difficult for people to justify the purchase of a headset.
Despite these challenges, there is a lot of potential for spatial computing. It has the potential to revolutionize the way we interact with computers and the world around us. The Vision Pro headset could be a major step towards making spatial computing a reality.
Here are some of the potential benefits of spatial computing:
It could make it easier to learn new things. For example, students could use AR to visualize complex concepts or to explore historical sites.
It could make it easier to collaborate with others. For example, teams could use AR to work on projects together or to brainstorm ideas.
It could make it more enjoyable to play games. For example, gamers could use AR to interact with their environment or to play with friends who are not physically present.
It could make it easier to navigate the world. For example, people could use AR to get directions or to find information about their surroundings.
Overall, spatial computing has the potential to make our lives easier, more productive, and more enjoyable. The Vision Pro headset could be a major step towards making this a reality."
144,What do you think about the price difference between Apple's Vision Pro and Meta's headset?,"The price difference between Apple's Vision Pro and Meta's headset is significant. The Vision Pro is priced at $3,499, while the Meta headset starts at $999.99. This price gap is likely due to a number of factors, including the different features and capabilities of the two headsets.
The Vision Pro is a more premium product, with a number of features that are not available on the Meta headset. These features include a higher resolution display, a wider field of view, and eye tracking. The Vision Pro also has a more powerful processor, which allows it to run more demanding applications.
In addition to the difference in features, the price gap may also be due to the different target markets for the two headsets. The Vision Pro is aimed at consumers who are looking for a high-end VR experience, while the Meta headset is aimed at a wider range of consumers, including gamers and businesses.
It is important to note that the Vision Pro is still in its early stages of development, and it is possible that the price will come down once the product is more widely available. However, even if the price does come down, it is likely to remain significantly higher than the price of the Meta headset.
Ultimately, the decision of whether or not to purchase the Vision Pro will come down to individual needs and budget. If you are looking for a high-end VR experience and are willing to pay a premium, then the Vision Pro may be a good option for you. However, if you are looking for a more affordable VR headset, then the Meta headset may be a better choice.
If you want more information then you can visit our profile."
145,What are the key features and capabilities of Apple Vision Pro?,"Apple Vision Pro is a powerful technology framework developed by Apple that encompasses a range of features and capabilities related to computer vision and image processing. It is designed to enable developers to integrate advanced vision capabilities into their applications. Here are some key features and capabilities of Apple Vision Pro:
Object Detection: Apple Vision Pro allows for accurate and efficient object detection in images and videos. It can identify and locate various objects within a scene, providing developers with the ability to build applications that can detect and track objects of interest.
Image Recognition: The framework incorporates deep learning models to perform image recognition tasks. It can classify images into predefined categories, such as identifying different types of animals, objects, or landmarks. This capability enables developers to create applications that can understand and interpret visual content.
Text Recognition: Apple Vision Pro offers robust text recognition capabilities. It can detect and extract text from images, including printed text or handwritten notes. This feature is particularly useful for applications that involve tasks like scanning documents, recognizing text in images, or building augmented reality experiences with text overlays.
Image Analysis: The framework provides tools for analyzing and understanding the content of images. It can extract various features from images, such as facial expressions, emotions, or scene attributes like color and composition. Developers can leverage these capabilities to create applications that perform detailed image analysis and extract valuable insights.
Barcode and QR Code Detection: Apple Vision Pro includes built-in support for barcode and QR code detection. This allows developers to build applications that can scan and interpret these codes, enabling tasks like product identification, inventory management, or digital content retrieval.
Augmented Reality (AR) Integration: Apple Vision Pro seamlessly integrates with Apple's ARKit framework, which empowers developers to create immersive augmented reality experiences. By combining computer vision capabilities with AR, developers can overlay virtual objects onto the real world and interact with them using real-time vision data.
Privacy and Performance: Apple Vision Pro prioritizes user privacy and device performance. It performs on-device processing, ensuring that sensitive data stays within the user's device and reducing reliance on cloud-based services. This approach helps protect user privacy and provides fast, real-time results.
If you want to know about key features of some more apple products then you can visit our official site.
Apple
Products Reviews, Problems & Solutions - ExitCentre
Overall, Apple Vision Pro offers developers a comprehensive set of features and capabilities to enhance their applications with advanced computer vision functionality. From object detection and image recognition to text extraction and AR integration, this framework empowers developers to create innovative and engaging visual experiences."
146,I have a better design for the Apple Vision Pro headband. Who should I partner with to produce it?,"You’re a bit late out of the gate chief since the Vision Pro is already in production.
Maybe you can take your “design” over to Facebook and improve their disaster of a product."
147,Which app on Apple's Vision Pro are you most looking forward to trying out?,There isnt any one particular app because this is a whole new device that Apple had put out. Their mixed reality headset is very interesting.
148,Are you going to book a demo to try Apple's Vision Pro headset?,"I would definitely book a demo session to experience Apple's Vision Pro headset. This cutting-edge device represents a significant advancement in immersive technology and offers a unique opportunity to explore its features and capabilities firsthand. By booking a demo, I gain direct access to the Vision Pro headset's innovative features and functionalities. From its exceptional visual quality and seamless integration with Apple's ecosystem to its intuitive controls and immersive user interface, experiencing the headset in person will provide valuable insights into its potential applications and benefits. Watching online videos is good, but I find scheduling a demo is an excellent way to get an up-close look at what the Vision Pro headset has to offer."
149,Do you think the discomfort from wearing Apple's Vision Pro headset will go away with time?,"Following a plethora of complaints, including headaches and eyesight issues, owners of the Apple eyesight Pro are returning it to the Apple store. This is because the product was used for an extended period of time.
Apple stated in a disclaimer that using the Vision Pro headset could ""increase your risk of injury or discomfort"" and aggravate some pre-existing medical conditions. Headaches, vertigo, eye problems, inner ear pain, seizures, skin problems, and more were among these problems.
Apple advises against starting with extended hours when wearing the augmented reality headset and instead to gradually increase your usage. Customers should ""start using Apple Vision Pro gradually to get adjusted"" and take regular breaks, according to advice from the iPhone maker."
150,What should we pay attention to in Apple's Vision Pro technology?,"Smartphones are changing the brains of our children, and schools are not equipped to meet their needs. Vision Pro technology may be the answer. But if you use the technology to teach them, then you should use the same technology to test them.
If Vision Pro technology becomes standard for white collar workers, then students will be better prepared."
