sentence,features
I was one of the first members of the public to experience the Apple Vision Pro demo.,experience
"Though it completely filled your entire vision field, it didnt work perfectly.",vision
"There was all kinds of distortion from the mismatch of the screen and the camera lenses curvatures, plus the imperfections of projected film.",vision
"I love the convenience and simplicity of it  no mouse or extra gear, always ready to go with no boot-up.",general
"You point with your eyes (yep, it follows that) and click with your fingers  wherever they are.",general
"You navigate with your eyes and fingers, stretch and zoom.",general
"Amidst the ever-changing landscape of technology, Apple's Vision Pro stands as a beacon of innovation, promising to revolutionize the way we interact with the digital world.",technology
"The Vision Pro's full potential lies in the distant future, with its mature, mass-market version not expected until 2030 or beyond.",technology
It is stunning.,general
It is a technological marvel almost beyond imagination.,technology
It is also clear that it is literally an order of magnitude more advanced than any other AR/VR product ever developed.,AR/VR
" It's too new fangled for my father generation, too fiddly and intrusive and inconvenient for my generation, and too expensive for the next generation.",experience
"But for me and those of my ilk (tech enthusiasts and a very few adopters) who can afford it, the Vision Pro is like taking a jump 5,10 years into the future.",experience
"Whereas the technology involved in Apple previous product launches was generally the best of what was currently available put into a consumer friendly format, the Vision Pro is all that plus introducing an insane collection of raw technological advances, overlaid (literally) onto a worldview that is fundamentally different from what the incumbent market players have done so far..",technology
"With the Vision Pro, Apple has done what it inarguably does better than any other organization on the planet: deliver best of breed hardware and an elegant, cohesive, comprehensive, operating system that integrates with everything else that Apple produces or sells.",technology
"The apps and demos available at launch are, in many cases, mind-blowing, what James Cameron declared to be  religious experience.",technology
"Watching films in Apple new Immersive Video (180 degree, 8k, 3D) is like nothing you have ever seen.",vision
"Unlike the compromises necessary with existing AR attempts, Apple insanely high resolution cameras and displays, combined with its powerful Apple silicon chips, delivers on the promise of true spatial computing in your own real world environment.",AR/VR
"Apple envisions the Vision Pro as a trailblazing entry into a ""new era of spatial computing."" As a standalone wearable computer, its primary aim is to revolutionize various experiences, such as watching TV, working, reliving digital memories, and enabling remote collaborations, especially in apps like FaceTime.",experience
The Vision Pro marks Apple's significant entry into a new product category after an eight-year gap.,headset
"It introduces a revolutionary type of headset that offers unique control capabilities through the wearer's eyes, hands, and voice, a key differentiator not found in other headsets.",headset
"Apple CEO Tim Cook referred to it as the company's first product that you ""look through"" rather than ""look at,"" highlighting its groundbreaking concept of ""spatial computing"" and the addition of a new dimension to the world of powerful personal technology.",technology
It's a Vr and Ar product newly launched by Apple .,AR/VR
It's going to be a game changer for Apple like the iPhone .,AR/VR
Seeing the growing use of Virtusl and augmented technologies Apple has stepped in to carve a niche for itself in this arena,AR/VR
"Apple Vision Pro, as of my knowledge cutoff in September 2021, is not a specific technology or product developed by Apple.",general
"However, Apple has various technologies and frameworks, such as Core ML and Vision, that enable developers to incorporate machine learning and computer vision capabilities into their applications.",general
"Unlock the Power of Apple Vision Pro for Enhanced Visual Experiences
In today's fast-paced digital world, staying ahead of the competition requires embracing cutting-edge technologies that can revolutionise user experiences.",technology
One such breakthrough innovation is the Apple Vision Pro.,technology
"This revolutionary technology is set to transform the way we perceive and interact with visuals, bringing a whole new level of immersion and realism to our digital encounters.",technology
"Future iterations of the Apple Vision Pro may see improvements in hardware components, such as upgraded cameras, sensors, and processors to enhance performance and capabilities.",technology
"Take everything that Vision Pro does and put it into eyeglasses and contacts that look and feel no different than regular eyeglasses or contacts, eventually making phones somewhat obsolete.",vision
I feel like thatÄôs the next logical step.,vision
"YouÄôll be able to type on a virtual keyboard, get map and turn-by-turn navigation right in your lenses, get info on landmarks, ratings on restaurants that you walk by, iMessages and email, YouTube, even FaceTime.",vision
"I wouldn't expect anything before 2027 or 2028 (contacts are still a decade away at least) and until then, IÄôd just expect the iterations of Vision Pro to become smaller, cheaper, less-bulky, more battery-efficient, and likely transparent at some point, as they move closer to eyeglasses.",general
In the downside the pass through video is not good enough to read text well.,vision
Using my phone while I have the headset on sucks for example.,vision
In the other hand if you misalign the headset it appears blurry and also the eye tracking is off and it is hard to select small objects.,headset
The VR equivalent of desktop wallpaper is amazing.,AR/VR
"My brain thinks I'm actually at Mt Hood, or in the desert, or whenever.",AR/VR
It is an amazing effect.,AR/VR
on the downside if you don't want a huge private TV/movie theater there isn't all that much I can say would make me want to pay $3.5k for it right now.,price
The purpose of the Vision Pro is to capture the power and creativity of app developers in the augmented reality space.,technology
I don't intend to lay out $4k (with tax and AppleCare) until its proven with AR apps I would use and even then I would hope to see price drops due to the economy of scale.,price
"Ultra-High-Resolution Display: Apple Vision Pro boasts micro-OLED technology, providing an ultra-high-resolution display system with 23 million pixels across two displays, offering more than a 4K TV resolution for each eye, which significantly enhances visual fidelity.",vision
"Personalized Spatial Audio: It features an advanced Spatial Audio system with two individually amplified drivers inside each audio pod, delivering Personalized Spatial Audio based on the userÄôs head and ear geometry.",vision
"EyeSight & Persona Awareness: A unique feature where an external display shows the user's eyes to other people in the room, indicating the userÄôs level of engagement and awareness, designed to ensure the user is never isolated from their environment.",vision
"if you prioritize augmented reality (AR) and virtual reality (VR) experiences, the Apple Vision Pro could be a better choice, as it is specifically designed for immersive visual experiences.",AR/VR
I suppose the first concern was regarding its weight on your head.,headset
The second was about vertigo or nausea from extended use.,headset
A third might be whether the tech innovation was superior enough to warrant the price.,price
"Most reviews have responded to the weight issue with a meh as they didn't seem bothered by it, and quickly adapted after a few days.",headset
The accuracy of the pass through video is helping reduce the sense of disconnect with the real world and seems to be much less of an issue than with some other headsets.,headset
"The tech experience is so compelling and impressive that most reviews have addressed the development as very impressive and some say a game changer in terms of clarity, visual accuracy and reliable interface operation.",experience
"The Vision Pro weighs dramatically more then a phone, takes a minute or three to strap to your head, has only a two and a half-ish hour battery life",headset
looks rather ridiculous and costs about 4x what an expensive phone costs.,price
EyeSight is an eye-tracking feature in Apple Vision Pro that lets others know when you are using the headset or fully immersed in an AR experience.,vision
It isn't yet clear how much entertainment will be consumed with the Vision device but the resolution of the images at very high frame rates suggests that 3D content may make a comeback along with some other stylistic elements in future content to amplify the immersive experience.,experience
"Described by Apple as a ""spatial computer,"" the Vision Pro seamlessly integrates digital media with the real world, offering an immersive AR experience.",experience
"Users will be able to interact with the system using a combination of motion gestures, eye tracking, and voice input.",experience
"It features high-resolution displays, precise eye-tracking technology, and a range of sensors for spatial mapping and hand tracking.",AR/VR
"With its sleek design and advanced features, the Apple Vision Pro represents a significant leap forward in the field of augmented reality, unlocking new possibilities for various industries and entertainment applications.",AR/VR
"Ultimately, the Apple Vision Pro offers a glimpse into the future of computing, but it's not yet fully refined for widespread adoption.",general
"With ongoing development and iteration, future versions may address current shortcomings, paving the way for more seamless integration of virtual and real-world experiences.",general
"Despite its potential, the device is not without its challenges.",general
"Issues such as weight distribution, app functionality, and ergonomic concerns highlight areas for improvement.",general
"Additionally, while the device excels in certain aspects like hand-tracking and eye-tracking, there are limitations in areas like app management and passthrough video quality.",general
There could be several reasons why many people might find it difficult to afford the Apple Vision Pro or any other expensive product.,price
"The Apple Vision Pro is a premium product with advanced features, and as such, it carries a significant price tag.",price
"The high cost makes it unaffordable for a large portion of the population, particularly those with limited financial resources.",price
"Economic inequalities exist in society, meaning that people have varying levels of income and wealth.",price
The price of the Apple Vision Pro may be beyond the means of individuals who fall into lower income brackets or who are struggling financially.,price
"This is a niche product that will have a very small user base, because of price, and size.",price
Think of this as being like the very first cell phone.,headset
"Big, bulky, and not very mobile.",headset
"Apple Vision Pro offers a comprehensive suite of tools and features tailored to enhance productivity, creativity, and efficiency in professional settings.",general
"Users benefit from advanced image and video editing capabilities, including precise color grading, seamless integration with Apple's ecosystem, and powerful AI-driven tools for tasks like object removal and scene enhancement.",general
"Apple Vision Pro sets a new standard for professional image and video editing, offering unparalleled versatility and efficiency for professionals across various industries",general
My sense of it is that I usually sit alone at my keyboard for a few hours working on some projects which is my profession.,general
Sitting alone with my Vision goggles for a few hours will turn out to be just as easy.,general
"And, if the interface responds more quickly to where I'm looking than does my trackpad, then I might be finishing my project quicker than before.",general
Vision Pro is the first VR headset designed to capture and play back stereoscopic video and photos.,AR/VR
"Apple calls these immersive formats, which capture and play back memories with amazing depth, Spatial Videos and Spatial Photos.",AR/VR
"Alternatively, you can shoot Spatial Videos with an iPhone 15 Pro (Max).",AR/VR
"While the quest for the definitive app for Apple Vision Pro may be fraught with complexity, the allure of what lies ahead is undeniable.",general
"Embrace this journey, for within its twists and turns lies the promise of transformative experiences that transcend the bounds of imagination.",general
Do you have $3499 you can throw away?,price
"If not, then that's the biggest drawback of all.",price
"You can use Apple Vision Pro to watch movies, TV shows, and other content in your living room or bedroom.",vision
The headset's high-resolution displays and spatial audio system will provide you with a truly immersive experience.,vision
The headset's eye tracking and hand tracking features will allow you to interact with virtual objects in a natural way.,headset
Products have 2 things.,general
"Experience, and measurable performance.",general
Apple has top level designers and engineers.,general
"Probably earning salaries of $100,000 to $500,000.",general
"Apple has more of the top level people, and also better machinery/tools, and bigger budget.",general
"That helps them achieve the best products in terms of performance, and experience.",general
Apple Vision Pro is early and best.,general
"And, improving at a very fast speed.",general
It's going to be an insurmountable lead by Apple.,general
"Again, with the best design, best ux, which is the artistry part.",general
"And, the technology Is high performance, and ux is objectively optimized for speed and ease of use which are parts of performance.",general
"During the brief demo, Apple walked me through the setup process and I got to experience a number of VR and AR experiences.",experience
"I was able to take a FaceTime call, check out some immersive videos and photos, browse the web with multiple windows opened, watch a few 3D movie clips and more.",experience
"The Vision Pro is unlike pretty much any other AR / VR headset, in that it doesn't require any extra hardware for you to control it.",experience
It's decked out with a multitude of cameras and sensors for eye-tracking and hand-tracking and it works remarkably well.,experience
"To move your (mouse) pointer, you just look at the app or virtual button you want to press, and then tap your pointer finger and thumb together (either hand works); this acts as a click.",experience
"To scroll, simply hold those same fingers together and pull up or down, left or right.",experience
"It takes a bit of practice, but after a few minutes, it's pretty intuitive.",experience
"Honestly, it's pretty incredible.",experience
"The other neat thing is, it doesn't really matter where your hands are placed.",experience
"You can have them out in front of you or resting at your side, and the device will still detect your movements.",experience
The cameras in the Vision Pro can do a remarkably good job at picking up your clicks and scrolls without making you work that hard.,experience
It feels natural and relaxed.,experience
So basically it is a great product from Apple,general
"but looking at the price, it is not going to be everyone's cup of tea",price
"Right now, Apple is in a weak marketing position because there are no new features for the iPhone 15 series except for the change to USB-C connectors.",general
It looks like Apple is putting more marketing weight behind Apple Watch than the iPhone.,general
"Like any other Apple product, Vision Pro comes with a hefty price.",price
This tech won't become widely adopted until either a) it becomes far more fashionable / practical or b) the utility of the device is so compelling itÄôs appearance just doesn't matter.,general
"I wouldn't walk around with that thing strapped on my head and I have no problem not owning one, so it seems they're a ways away.",general
"Apple's entry into the AR/VR hardware market could drive advancements in display technology, sensors, and processing power, making these technologies more accessible and compelling for consumers.",AR/VR
I'm sure the Vision Pro will eventually have immersive game play and VR exclusive experiences.,AR/VR
"For now, the removal of a dedicated desk, lamp, mouse, and monitors is the main story.",AR/VR
But that could change once the developer community releases a bunch of apps which make the device do much more.,AR/VR
For solo experiences and singular media consumption it seems a trifle overkill to use a Vision Pro but when I think of how much some people spend on a TV set it doesn't seem that much more expensive.,AR/VR
The tech industry is highly competitive.,general
Apple would need to differentiate the Apple Vision Pro from existing and upcoming products in the market.,general
"Compliance with regulations and standards related to technology, privacy, and health features (if applicable) can pose challenges during development.",general
"Convincing consumers to adopt a new product, especially if it introduces a novel form factor or functionality, can be a challenge.",general
Educating the market about the value proposition is crucial.,general
"Overcoming technical challenges, whether related to hardware, software, or both, can impact the development timeline and the product's overall success.",general
"If the Apple Vision Pro involves collecting personal data or incorporates sensors, addressing privacy concerns and ensuring data security would be paramount.",general
Apple has a strong brand and a loyal customer base.,general
"Leveraging this loyalty can facilitate the adoption of new products, especially if they seamlessly integrate with the existing Apple ecosystem.",general
We are all hoping they will.,general
"If what they've done in the past is any indication of future releases then we might see a Pro, a Max, and an Ultra version of Vision Pro.",general
They might do it like the iPad and make the earlier versions cheaper each time they release another version.,general
"If you look at the iPhone line up right now with their many versions we might see a ""scaled down"" Vision Air or just a Vision which is meant for general use, and eventually an upper tier of even more expensive versions with more features and capabilities.",general
If you look at the MacBook line you can probably guess that the intitial cost of a fully capable Mac has remained relatively steady since the 1990s.,general
Spacial Computing might catch on and people might be willing to reduce their chances of getting repetitive stress injury from no longer needing a mouse.,general
Or it might be a short lived experiment for a consumer who is just as happy with their laptop or iPad.,general
Interactions with Apple Vision Pro are designed to feel natural and intuitive.,general
"The headset uses a variety of sensors to track the user's head movements, eye gaze, and hand gestures.",general
This data is then used to control the headset's interface and interact with virtual objects.,general
The Apple Vision ProÄôs Passthrough feature is truly remarkable! ,general
The Passthrough feature provides a transparent view of the real world.,vision
"When activated, it uses the headsetÄôs cameras to capture the environment and overlay digital elements.",vision
This transparency ensures that users can navigate their physical surroundings without removing the headset.,vision
Passthrough enhances contextual interaction.,AR/VR
"For instance, if you're cooking and following a recipe in AR, Passthrough lets you see your kitchen counters, utensils, and ingredients while still displaying the recipe steps.",AR/VR
It's a seamless blend of digital guidance and real-world context.,AR/VR
"When privacy is crucial (like during personal conversations or in sensitive environments), you can activate Passthrough to temporarily switch off the digital overlay.",AR/VR
This ensures privacy without fully removing the headset.,AR/VR
"In summary, Passthrough is a game-changer for augmented reality (AR) and mixed reality (MR) experiences.",AR/VR
"It bridges the gap between the digital and physical realms, making the Vision Pro a versatile and user-friendly device.",AR/VR
Watching motion pictures on the Apple Vision Ace resembles being in a film.,AR/VR
"The image is so clear and the sound is so vivid, it resembles you're in that general area in the activity.",AR/VR
Messing around on the Apple Vision Genius resembles being in the game world.,vision
"The controls are so responsive and the illustrations are so reasonable, it's like you're really playing the game.",vision
FaceTimeing on the Apple Vision Expert resembles being in a similar room with the individual you're conversing with.,vision
"The video quality is so great, it resembles you're sitting right close to them.",vision
"In any case, in general, early surveys recommend that the Apple Vision Expert is an exceptionally great piece of innovation that offers a genuinely vivid and reasonable experience.",vision
The Apple Vision Master utilizes eye following innovation to follow your eye developments and change the focal point of the presentation as needs be.,vision
"The Apple Vision Master likewise has haptic criticism, which gives actual impressions that relate to what's going on in the virtual world.",experience
This can cause the experience to feel significantly more practical.,experience
"Generally speaking, the Apple Vision Ace is a strong and flexible VR headset that offers a really vivid encounter.",headset
Absolutely not! I consider the product over priced when benefits versus costs are viewed objectively.,price
The price must come down by 50% before I would consider buying Vision Pro.,price
"Apple's Vision Pro headset takes tech beyond the screen, merging digital and physical worlds in ways you've scarcely imagined.",general
"n short, the Vision Pro headset takes our reality and gives it a heap of digital excitement.",experience
Apple has made significant advancements in spatial audio for their Vision Pro product.,headset
"Spatial audio technology creates an immersive audio experience by simulating sound coming from different directions, adding depth and realism to the audio content.",headset
"With the Vision Pro, Apple has introduced advanced spatial audio algorithms that enhance the overall listening experience.",headset
"Moreover, Apple has improved the spatial audio rendering quality, optimizing the algorithms to deliver enhanced spatialization and sound localization.",headset
"In summary, Apple has made significant advancements in spatial audio for their Vision Pro product, including the integration of head tracking, increased support for audio channels, and improved rendering quality.",headset
These advancements contribute to a more immersive and realistic audio experience for Vision Pro users,headset
"It was a sunny morning, and I woke up feeling excited because the day had finally arrived to try out my new Apple Vision Pro.",experience
"I had been eagerly anticipating its arrival, and now it was time to put it to the test.",experience
"As I slipped the sleek device onto my face, I was immediately impressed by its lightweight design and comfortable fit.",experience
It felt like a natural extension of my own eyes.,experience
The first thing I noticed was the stunning display quality.,vision
"The images and videos appeared crystal clear, and the colors were vibrant and true to life.",vision
I couldn't help but immerse myself in the virtual world that unfolded before me.,AR/VR
"Whether I was exploring virtual landscapes, watching movies, or even browsing the internet, the Apple Vision Pro delivered an immersive experience like no other.",AR/VR
But what truly amazed me was the device's advanced augmented reality capabilities.,AR/VR
" And thanks to its long battery life, I didn't have to worry about running out of power, even during busy days.",technology
"Apple Vision Pro's unique 3D camera allows users to capture spatial photos and videos in 3D, which can be viewed and interacted with on other Apple devices or through Apple's AR platform, RealityKit.",vision
Apple Vision Pro is Apple's first 3D camera-equipped device.,vision
Better for what purposes?,general
A meta Quest 3 may be a better value for certain purposes.,general
But generally the Apple Vision Pro is the better product.,general
More capable and higher resolution.,general
"Enhanced AR (Augmented Reality) Apps: With the rumored ""Apple Vision Pro"" device, which might be focused on augmented reality, users could have access to a range of AR apps.",AR/VR
"Specialized Vision and Accessibility Apps: The ""Apple Vision Pro"" device could potentially cater to users with specific visual needs or impairments.",vision
"These apps might include image recognition, facial recognition, machine learning, and deep learning applications for tasks like image analysis, object detection, sentiment analysis, and more.",technology
"However, Apple has developed various technologies and frameworks related to computer vision and augmented reality (AR) that could potentially involve real-time 3D mapping.",AR/VR
Real-time 3D mapping plays a crucial role in AR applications by providing the ability to understand the geometry and structure of the physical environment in real time.,AR/VR
"It allows devices to detect and track surfaces, recognize objects, and create accurate representations of the surroundings.",AR/VR
