sentence,features
"- **Compatibility with Apple AirPlay:**
- Users can use Apple AirPlay to stream Disney+ content from their iOS devices (iPhone, iPad) to their Apple TV or AirPlay-enabled smart TVs.
- **Subscription Integration with Apple ID:**
- Subscribers may have the option to manage their Disney+ subscription and payments through their Apple ID account, providing a seamless billing experience.",general
"Please note that the specific benefits for Apple users can depend on the device, operating system version, and any partnerships or features introduced after my last update.",general
"It's recommended to check the official Disney+ website or the Apple App Store for the most current information regarding subscription costs, features, and compatibility with Apple devices.",general
What are some notable apps and games that have been created for Apple's Vision Pro headset?,technology
"Augmented Reality Apps: These could include utilities for navigation, interior design, education, and more, utilizing the headset's AR capabilities to overlay digital information onto the real world.",technology
"Virtual Reality Games: Immersive VR experiences designed to take advantage of the headset's capabilities, offering users a range of gaming experiences from adventure to simulation.",technology
"What does Apple CEO Tim Cook mean when he says, ""The Apple Vision Pro is just the beginning""?",general
"You know how Apple made the iPhone, and a year later the iPhone 3G, and a year later the iPhone 3GS, and a year later the iPhone 4, and kept adding one to the number, or throwing an S on the end for years since (and occasionally doing things like skipping over the 9)?",general
Probably something like that.,general
"Expect Apple to have a future product like the Vision Pro but ÄúbetterÄù, it is what they normally do with their products, so no big shocker.",general
What do you think of U.S. Transportation Secretary Pete Buttigieg's comments on Tesla drivers using VR headsets like Apple's Vision Pro?,technology
"As an AI language model, I don't have personal opinions.",technology
"However, I can provide some analysis.",technology
U.S. Transportation Secretary Pete Buttigieg's comments on Tesla drivers using VR headsets like Apple's Vision Pro would likely be concerned with safety and distracted driving.,technology
"Using virtual reality headsets while driving poses significant risks, as it diverts the driver's attention away from the road and surroundings, increasing the likelihood of accidents.",technology
Buttigieg's remarks would likely emphasize the importance of prioritizing safety on the roads and discouraging behaviors that contribute to distracted driving.,technology
Encouraging drivers to stay focused on the task of driving and avoid distractions is crucial for reducing the number of accidents and ensuring road safety for everyone.,technology
"Overall, Buttigieg's comments would likely be aligned with efforts to promote responsible and attentive driving habits, particularly in the context of emerging technologies like virtual reality headsets.",technology
"If I know how to build iOS applications, does that automatically mean I can also build apps in Apple Vision Pro?Sure thing, let's get into this.",technology
"Just because you know how to whip up awesome iOS applications, it does not necessarily hand you the golden ticket to crack Apple Vision Pro.",technology
"Here's why:
Coding iOS apps usually involves Swift or Objective-C, while Apple Vision Pro, part of Apple's Pro Apps family, is a bit of a different beast.",technology
"It's a high-end video editing tool, not typically something you fiddle with code for.",technology
"You'd be juggling clips and transitions, not classes and objects.",technology
"It's a whole different realm of software, my friend.",technology
"Plus, you'll need some solid skills in video editing or production to really rock it, not just coding.",technology
This isn't to say your experience doesn't count though.,technology
Understanding Apple's ecosystem will certainly smooth out the bumps on that learning curve.,technology
"You'll pick up the basics quicker, for sure.",technology
"But, we're talking about a video editing tool, not an app-development platform.",technology
"So, youÄôve got some new tricks to learn.",technology
"You know what they say, there's no harm in trying, right?",technology
"So, dust off that learning hat and get stuck into it.",technology
"Who knows, yo",technology
In what ways could mixed-reality headsets like Apple's Vision Pro be used beyond entertainment and gaming?,technology
Answer: Everything.,technology
"If implemented correctly (admittedly a big if), mixed-reality displays can be a better place to run all of your existing software (with as many ÄòscreensÄô as you want), plus run new software that takes advantage of 3D, such as 3D sketching systems.",technology
Those of us old enough remember when suddenly the ÄòPowerPoint warriorsÄô were winning most of the battels of Äòpresenting your new idea to managementÄô.,technology
3D sketching systems might one-up this.,technology
This is the whole reason that Apple has such a project.,technology
"Apple is rightfully worried that, past some thresholds in comfort and wear-time, there will be a mass migration for people to move to doing all of their use of a ÄòcomputerÄô from inside a more productive MR display system.",technology
Most all existing 2D apps are easily ported to a virtual screen inside an MR display system.,technology
New apps built from the ground up around 3D MR capabilities for business and design use WILL happen.,technology
"Apple wants to be an important player in this game, even at the cost of building their Vision Pro, which will mostly be used by companies to experiment with what might be possible in MR, but NOT to ship SW applications in volume for this first device.",technology
How does Apple Vision Pro balance your privacy and social interactions?,technology
Apple has a strong emphasis on privacy and has implemented various measures to protect user data.,technology
"Here are some ways Apple strives to balance privacy and social interactions:
Privacy by Design: Apple incorporates privacy features directly into its products and services from the ground up.",technology
"They prioritize user privacy by default, ensuring that personal data is protected without requiring users to take extra steps.",technology
"Data Minimization: Apple minimizes the collection and use of personal data, only gathering information that is necessary for the functioning of its products and services.",technology
This approach limits the exposure of user data.,technology
"User Control and Transparency: Apple provides users with granular control over their privacy settings, allowing them to manage permissions and choose what data is shared with apps and services.",technology
"Apple also promotes transparency by clearly explaining how user data is collected, used, and protected.",technology
"On-Device Processing: Apple prioritizes on-device processing, aiming to perform computations and analysis directly on the user's device instead of relying on cloud-based processing.",technology
This helps protect user privacy by reducing the amount of data sent to external servers.,technology
"End-to-End Encryption: Apple implements end-to-end encryption for certain services, such as iMessage and FaceTime, ensuring that only the sender and recipient can access the content of their communications.",technology
"App Store Review Process: Apple maintains a strict review process for apps available on its App Store, which includes scrutinizing privacy practices.",technology
This helps ensure that apps meet privacy standards before being made available to users.,technology
"While prioritizing privacy, Apple also aims to facilitate social interactions through its products and services.",technology
"Features like iMessage, FaceTime, and various social apps on the App Store enable users to connect, communicate, and share experiences with others.",technology
It's worth noting that privacy and social interactions can sometimes present a trade-off.,technology
Striking the right balance involves implementing privacy measures to protect user data while offering features and functionalities that enable meaningful social interactions.,technology
Please keep in mind that specific details about Apple Vision Pro or any potential updates or changes since September 2021 may not be captured in my knowledge.,technology
"For the most accurate and up-to-date information, I recommend referring to official Apple documentation or announcements.",technology
"What makes Bank of America bullish on Apple's Vision Pro product?If Bank of America is bullish on Apple's Vision Pro product, their reasons could be influenced by various factors such as:
Positive views may be based on the perceived innovation and advanced technology embedded in Apple's Vision Pro product.",general
"Features, capabilities, and advancements that set it apart from competitors could be driving optimism.Analysts often consider the potential market demand for a new product.",general
"If Bank of America sees significant market potential for Apple's Vision Pro, they might express bullish sentiment based on expected consumer interest and adoption.Positive projections for Apple's financial performance, driven by the success of the Vision Pro product, could contribute to a bullish stance.",general
Financial institutions often assess the potential impact on a company's earnings.Apple's strong brand reputation and customer loyalty are crucial factors.,general
"If Bank of America believes that Apple's brand strength will contribute to the success of the Vision Pro product, it could influence their positive outlook.Evaluation of how Apple's Vision Pro positions itself against competitors in the market may play a role.",general
"If Bank of America sees a competitive advantage in terms of features, pricing, or other factors, it could contribute to a bullish stance.Analysts may consider broader market trends, such as the increasing demand for wearable technology or specific features in the tech industry.",general
"Positive market trends could bolster optimism.It's essential to note that financial analyses and viewpoints can change over time based on new information, market dynamics, and company developments.",general
"To obtain the most accurate and current insights into Bank of America's views on Apple's Vision Pro or any other financial analysis, it's recommended to check the latest reports, statements, or updates provided by Bank of America or other reputable financial institutions.",general
How does Apple Vision Pro ensure clear visibility of the world around you?,technology
"What are some potential solutions to avoid trademark issues when launching a product globally, like Apple's Vision Pro headset?",general
"When launching a product globally to avoid trademark issues, it is important to undertake thorough research and take necessary precautions.",general
"Here are some potential solutions to consider:
Conduct a comprehensive trademark search: Before launching a product, conduct a thorough search to ensure that the proposed product name, logo, or branding elements do not infringe upon existing trademarks in the target markets.",general
Engage professional trademark attorneys or search firms to assist with this process.,general
Obtain trademark registrations: Registering your trademarks in relevant jurisdictions provides legal protection and helps prevent others from using similar marks for similar products or services.,general
This can help establish your brand and avoid potential conflicts in the future.,general
"Adapt the branding: If potential trademark conflicts are identified, consider modifying or adapting the product name, logo, or branding elements to mitigate the risk of infringement.",general
"This might involve changing certain aspects of the design, color schemes, or wording to ensure distinctiveness.",general
"Localization and regional branding: In some cases, a product may have different names or branding in different regions to accommodate cultural differences or to avoid conflicts with local trademarks.",general
This approach allows for customization while maintaining a consistent global brand image.,general
"Collaborate with local experts: When entering new markets, seek guidance from local legal professionals, consultants, or business experts who are familiar with the local trademark laws and practices.",general
Their expertise can help you navigate potential trademark issues specific to each market.,general
Monitor and enforce your trademarks: Continuously monitor the market for potential infringements and take appropriate legal action if necessary.,general
"This includes monitoring online platforms, trade shows, and relevant industry publications to ensure others are not improperly using your trademarks.",general
Seek legal advice: Consult with intellectual property attorneys who specialize in trademark law to get personalized guidance tailored to your specific situation.,general
They can help you navigate the complex landscape of global trademark issues and provide advice on the best course of action.,general
"Remember that trademark laws and practices can vary from country to country, so it is crucial to understand and comply with the specific regulations in each target market to minimize the risk of trademark issues when launching a product globally.",general
What happens when someone approaches you while using Apple Vision Pro?,technology
"When someone approaches you while using Apple Vision Pro, the headset's EyeSight feature will automatically turn on.",technology
EyeSight is an eye-tracking feature that lets others know when you are using the headset or fully immersed in an AR experience.,technology
"When EyeSight is turned on, the headset will display a transparent window that shows the person approaching you.",technology
"The window will also show your eyes, which will let the person know that you are aware of them.",technology
"If you want to interact with the person approaching you, you can simply look at them and speak to them.",technology
"The headset will then switch to passthrough mode, which will allow you to see the real world through the headset's displays.",technology
You can then interact with the person in a natural way.,technology
"If you do not want to interact with the person approaching you, you can simply look away from them and the headset will return to its normal mode.",technology
EyeSight is a privacy feature that is designed to help you stay connected with the people around you while you are using Apple Vision Pro.,technology
It is also a safety feature that can help you avoid accidents by letting you see the real world around you.,technology
Do you think Apple's Vision Pro headset will be popular in Asian and European markets?,general
Well it wonÄôt.,general
Because it will not sell there.,general
The Apple Vision Pros have been associated with the US markets by Apple execs.,general
Apple is seeing wild success from meta quest headsets.,general
"According to leakers, The Apple Vision Pro 2 will be announced in 2025 and the WWDC.",general
Where they got this?,general
I donÄôt know.,general
But currently apple has specifically said on their website that the Apple Vision Pros will only be sold in the US and Canada.,general
"They wonÄôt ship to other continents, despite being made by child laborers in China and shipped to America.",general
"Apple tends to wait, I will not be purchasing the 1st gen Apple Vision Pros but instead wait to get the second version, where many improvements will be made such as battery life and so on.",general
"DonÄôt get me wrong, this display on the Apple Vision Pros is spectacular, and so is the whole Apple Vision Pro lineup.",general
But the second gen will most likely be leaps ahead.,general
"let apple work on the bug fixes and issues with the first gen, and let it get improved with VisionOS and physical issues.",general
What are you most excited to use the Apple Vision Pro headset for?I don't have personal feelings or preferences.,general
"However, the Apple Vision Pro headset, if it exists, could potentially offer advanced features for augmented reality experiences, immersive gaming, or innovative applications.",general
Its specific uses would depend on the capabilities Apple incorporates into the device.,general
Will consumer neurotechnology become mainstream through devices like Apple's Vision Pro?,general
What would be some of the first applications?,general
"The adoption and mainstream acceptance of consumer neurotechnology depend on various factors, including technological advancements, user acceptance, ethical considerations, and regulatory frameworks.",general
"If a product like ""Apple's Vision Pro"" were to emerge, it would likely face challenges and opportunities in the following ways:
Technological Advancements: Advances in neurotechnology, such as brain-computer interfaces (BCIs) or devices that interact with neural signals, could drive mainstream adoption.",general
"The technology's reliability, accuracy, and ease of use would be critical factors.",general
User Acceptance: The success of consumer neurotechnology depends on users' willingness to adopt and integrate such devices into their daily lives.,general
"Factors like user experience, privacy concerns, and perceived benefits would influence acceptance.",general
"Applications: Some of the first applications could include: Health and Wellness Monitoring: Consumer neurotechnology could be used for monitoring mental health indicators, stress levels, and sleep patterns.",general
"Enhanced User Interfaces: Brain-controlled interfaces could provide a more intuitive and efficient way to interact with devices, enabling hands-free control or improved accessibility features.",general
"Entertainment and Gaming: Neurotechnology could enhance immersive experiences in gaming or virtual reality, providing a new level of interaction based on neural signals.",general
"Cognitive Enhancement: Some applications might focus on enhancing cognitive abilities, such as memory, attention, or learning.",general
"Privacy and Ethical Considerations: As with any technology that interfaces with the human brain, there would be significant ethical and privacy concerns.",general
"Clear guidelines, consent mechanisms, and robus",general
What is Apple Vision Pro?I have written an article on 'Apple Vision Pro: Technology Why a New Invention' on my blog.,technology
"In it, you will understand that a future technology that can eliminate the need for mobile phones is made by the company Apple.",technology
"Click on the link given below and read the complete information #mobilephones
#computing
#future
#technology
#applevisionpro
Apple Vision Pro: §ç§?å§¶ç§Øã§ó§ø§ïÄ §ï§æ §è§ï §®§Ø§æ §Ü§µ§ø§?ç§ï§æ§?",technology
§´§º§ø§?§?§æ§?,technology
'Apple Vision Pro' §®§æ§Æ §ïá §?á§°§?á§ü §ï§Æ §óâ§ó§?ç§?,technology
§ïÄ §ö§?ç§ö§æ §?à §ú§ø§?á §?§æ§?,technology
§?Ä §Æá§Ç §üá§ïç§®ã§?â§úÄ §ïÄ §¶Å§®§ø§Ø§æ §ïÄ §ú§æ§®Ä-§Æ§æ§®Ä §ï§Ç§§®Ä Apple §®á §á§?,technology
§ï§ø§Ø§æ §?à.,technology
"§á§?á Apple
https://www.learnhub360.tech/2023/06/apple-vision-pro.htm",technology
"In what ways does MetaÄôs Quest fall short of being ""the better product"" compared to Apple's Vision Pro?",general
META never had the hardware or the software to make it a reality.,general
The only good thing they ever created is React and Torch.,general
"Apple has the SoC technology that drives Apple Vision Pro, both the R1 and the M2 chips.",general
"Even the M2 chip is a breakthrough for PC computing using mobile SoCs.
It actually has given the vision Pro the actual vision technology that it actually needs and puts it into the future.",general
What are the potential consequences of Mark Zuckerberg's criticism of Apple's Vision Pro headset?,general
"Mark Zuckerberg's criticism of Apple's Vision Pro headset could potentially have several consequences, both for Zuckerberg personally and for the relationship between Facebook (now Meta Platforms) and Apple:
1.",general
**Impact on Business Relations**: Publicly criticizing a competitor like Apple could strain the relationship between Meta Platforms (formerly Facebook) and Apple.,general
Both companies operate in the tech industry and have overlapping interests in areas such as augmented reality (AR) and virtual reality (VR).,general
"Friction between the two companies could affect potential partnerships, collaborations, or negotiations in the future.",general
2.,general
**Reputation and Perception**: Zuckerberg's criticism of Apple's Vision Pro headset could shape public perception of both companies and their respective products.,general
"Depending on the tone and substance of his criticism, it could impact how consumers view Meta Platforms' own AR and VR offerings compared to Apple's.",general
It could also influence perceptions of Zuckerberg's leadership style and approach to competition within the tech industry.,general
3.,general
**Market Dynamics**: Zuckerberg's criticism could contribute to ongoing debates and discussions within the tech industry about the future of AR and VR technology.,general
"His comments may influence investor sentiment, product development strategies, and market dynamics in the AR/VR space.",general
4.,general
**Legal and Regulatory Scrutiny**: Public disputes between major tech companies like Meta Platforms and Apple can attract attention from regulators and policymakers.,general
"Any allegations or claims made by Zuckerberg regarding Apple's products could potentially lead to legal challenges or regulatory scrutiny, especially if they involve accusations of anti-competitive behavior or unfair business practices.",general
5.,general
**Innovation and Competition**: Criticism from Zuckerberg could spur both companies to innovate and improve their respective products and technologies.,general
Healthy competition within the tech industry can drive advancements and benefit consumers by offering a wider range of options and features in AR and VR devices.,general
"Overall, the consequences of Zuckerberg's criticism of Apple's Vision Pro headset will depend on various factors, including how it is received by the public, how it impacts business relations between the two companies, and whether it leads to any significant changes in the tech industry landscape.",general
What is the advantage of capturing panoramas with Apple Vision Pro?,vision
Apple Vision Pro can capture panoramas with a wider field of view and higher resolution than traditional cameras.,vision
"What is the projected significance of Apple's Vision Pro headset, according to Bloomberg?",technology
"Apple's Vision Pro headset is projected to be a significant product for the company, as it could help to usher in a new era of augmented reality (AR) and virtual reality (VR).",technology
"The headset is rumored to be high-end and expensive, but it could still be a major hit with consumers and businesses alike.",technology
"Bloomberg Intelligence analyst Mark Gurman has said that the Vision Pro headset could be ""the most important product Apple has ever released."" He believes that the headset could revolutionize the way people interact with computers and the world around them.",technology
The Vision Pro headset is expected to have several features that could make it a popular product.,technology
"It is rumored to have a high-resolution display, a powerful processor, and a wide range of sensors.",technology
"The headset is also expected to be compatible with Apple's existing devices, such as the iPhone, iPad, and Mac.",technology
"If the Vision Pro headset is successful, it could help to make AR and VR more mainstream.",technology
"The headset could also open up new possibilities for businesses, such as training, education, and entertainment.",technology
"Here are some of the potential benefits of Apple's Vision Pro headset:
Augmented reality for productivity: The Vision Pro headset could be used to overlay digital information on top of the real world, which could make it easier for people to work and collaborate.",technology
"For example, a doctor could use the headset to see detailed medical information about a patient while they are performing surgery.",technology
"Virtual reality for entertainment: The Vision Pro headset could be used to create immersive virtual reality experiences, such as playing games, watching movies, or taking virtual tours.",technology
This could offer a new way for people to relax and have fun.,technology
"Mixed reality for social connection: The Vision Pro headset could be used to create mixed reality experiences, which combine elements of both augmented reality and virtual reality.",technology
"This could allow people to interact with each other in new and innovative ways, such as playing games together or attending virtual events.",technology
"Overall, the Vision Pro headset has the potential to be a major product for Apple.",technology
"It could help to usher in a new era of AR and VR, and it could offer a wide range of benefits for consumers and businesses alike",technology
In what ways can external battery pack be used with Apple Vision Pro?,general
Apple says it will offer a battery with two hours of power.,general
