,title,content
259,What are some potential drawbacks to using XR headsets like Apple Vision Pro on a plane?,"Using XR headsets like the Apple Vision Pro on a plane can indeed have some potential drawbacks. Here are a few possible considerations:
Safety concerns: One of the main concerns with using XR headsets on a plane is safety. During takeoff, landing, and turbulence, passengers are required to be aware of their surroundings and able to respond to any emergency instructions. Wearing a VR headset can impede your ability to see and hear important announcements or instructions from the flight crew, potentially compromising your safety and the safety of others.
Restricted movement: XR headsets typically require some physical space to move around and fully experience virtual reality. In the limited space of an airplane seat, it may be challenging to move freely without disturbing neighboring passengers or accidentally hitting objects. This restricted movement can detract from the immersive experience and make it less enjoyable.
Discomfort and motion sickness: Some individuals may experience discomfort or motion sickness when using XR headsets, especially during long flights. The combination of virtual movement and the sensation of being stationary can lead to a disconnect between what the eyes see and what the body feels. This sensory conflict may cause symptoms such as nausea, dizziness, or headaches, making the VR experience unpleasant or even intolerable.
Battery life and power constraints: XR headsets require power to function, and their battery life may be limited. On long-haul flights without access to charging options, using an XR headset for an extended period could drain its battery and leave you without entertainment or other necessary functions.
Social considerations: Air travel often involves interacting with fellow passengers, flight attendants, and other staff. Wearing an XR headset can isolate you from your immediate surroundings, making it difficult to engage in social interactions or respond to requests from the flight crew. It may also create an unintended barrier between you and the people around you.
Regulatory restrictions: Some airlines and aviation authorities may have specific rules or regulations regarding the use of electronic devices or headsets during flights. It's important to check with the airline beforehand to ensure that using an XR headset is allowed and complies with their policies.
It's worth noting that the specific drawbacks and limitations can vary depending on the type of XR headset and the airline's policies. It's always advisable to consider these factors and exercise caution when using any electronic device or headset during a flight."
260,"How do you think Apple Vision Pro will redefine how we connect, create, and explore?", Vision Pro
261,What other potential applications do you see for Apple Vision Pro headsets?,"Sure thing! So, Apple Vision Pro headsets could have a big role in the gaming world. Think about it, immersive, augmented reality games that feel super realistic. Plus, thanks to their advanced tech, they might even level up fitness apps, making your morning yoga routine even more zen.
Now, let's chat education. These headsets could provide interactive and immersive learning experiences. Imagine you're studying ancient Rome and bam, you're standing right there in the Forum.
Don't forget about remote work either. With the pandemic and all, working from home has become the new normal. These headsets could make virtual meetings feel like you're in the same room as your colleagues. No more boring Zoom calls, eh?
One last thing, though. These headsets could be revolutionary for accessibility. Assisting those with visual impairments, they could provide audio descriptions of the user’s environment. Now, that's some next-level stuff right there!
Alright, hope this helps! Remember, tech keeps evolving, and there's probably a load more applications coming our way that we can't even imagine yet. So, stay curious!"
262,What are some alternatives to the Apple Vision Pro mixed reality headset?,"Great question! If you're not feeling the Apple Vision Pro vibe, no worries, there're some equally cool alternatives in the mixed reality headset world. First off, the Microsoft HoloLens 2; it's a beast in the MR landscape, offering high-quality visuals and great comfort. Next, we got the Magic Leap 1. A bit of an underdog, but it's certainly got its charm with a super immersive experience. Now, let's not forget about Facebook’s (Meta’s) Project Aria, it's still under wraps but the hype is real, pals!
It's a wild ride out there in the MR world, with new tech poppin' up all the time. Remember, it's not just about the brand or hype, it's all about what suits your style and needs best. So, keep exploring and have fun, you're bound to find your perfect match in this mixed reality universe. Cheers!"
263,How can you capture spatial photos and videos with Apple Vision Pro?,"You can capture spatial photos and videos with Apple Vision Pro by pressing the top button on the headset. When you're capturing a spatial video or photo, Vision Pro makes it clear to those around you that you're recording."
264,Are you concerned about the weight distribution of the Apple Vision Pro?,"NO !
Because i wouldnt buy anything produced by Apple
Its all overpriced fault ridden crap
Even worse the iphones are made in China !"
265,"With Apple's Vision Pro and Zoom's new visionOS app, how do you think meetings will change?","Apple's Vision Pro and Zoom's new visionOS app are both examples of advancements in technology aimed at enhancing virtual meetings and collaboration experiences. While the specific impact of these tools on meetings may vary depending on their adoption and integration into existing workflows, there are several potential changes and improvements that could result from their use:
Improved Accessibility: Both Apple's Vision Pro and Zoom's visionOS app are designed to enhance accessibility features, such as real-time transcription, captioning, and sign language interpretation. These features can make meetings more inclusive and accessible to individuals with disabilities, providing them with better opportunities to participate and engage.
Enhanced Collaboration: Features such as augmented reality (AR) overlays, spatial audio, and interactive whiteboards offered by these tools can facilitate more engaging and interactive collaboration experiences during meetings. Participants may be able to visualize data, share ideas, and work together more effectively in virtual environments.
Seamless Integration: Integration with other productivity tools and platforms, such as project management software, document sharing platforms, and customer relationship management (CRM) systems, can streamline workflows and make it easier for participants to access relevant information and resources during meetings.
Personalized Experiences: Customizable settings and preferences, such as individualized layouts, backgrounds, and viewing options, can allow participants to tailor their meeting experiences according to their preferences and needs, improving overall satisfaction and engagement.
Enhanced Security and Privacy: Both Apple and Zoom prioritize security and privacy in their products, which can provide reassurance to users regarding the confidentiality and integrity of their meetings. Features such as end-to-end encryption, secure authentication, and privacy controls can help protect sensitive information and ensure compliance with regulatory requirements.
Overall, the combination of Apple's Vision Pro and Zoom's visionOS app has the potential to transform meetings by offering more accessible, engaging, and personalized experiences for participants while also prioritizing security and privacy. As these technologies continue to evolve and become more widely adopted, they may shape the future of virtual collaboration and communication in various industries and sectors."
266,Can Apple Vision Pro capture 3D content that can be viewed on compatible devices?,"Yes, Apple Vision Pro can capture 3D content that can be viewed on compatible devices. The headset has a 3D camera that can capture spatial photos and videos in 3D. These photos and videos can then be viewed on other Apple devices that support 3D, such as the iPhone 12 or newer, or on a Mac with the latest version of macOS.
Additionally, Apple Vision Pro can also capture 2D content and convert it into 3D. This means that users can view any content on Apple Vision Pro in 3D, even if it was not originally created in 3D."
267,What is your opinion on Zuckerberg's statement that Apple's vision for Vision Pro isn't the one he wants?,"Who cares what Zuck wants? Is he speaking for you or for me? He better not be, given that his empire’s collapse is nigh and that we did not vote for him. Anyone who everyone else is growing sick and tired of is a nuisance we don’t have to tolerate in a democracy. Zuck and his pod of cyborgs have only their delusions to defeat, and we can watch their tribulation as entertained and amused freemen."
268,Which mainland Chinese companies are part of Apple's Vision Pro supply chain?,"Mainland Chinese companies that are part of Apple's Vision Pro supply chain include BOE Technology Group Co., Ltd. and Sunny Optical Technology (Group) Co., Ltd. Please note that supply chain relationships can evolve over time, so it's advisable to refer to the latest sources for the most up-to-date information."
269,"Now that Apple came out with the Apple Vision Pro, is it a good idea that I bought stock in Apple? The stock seems undervalued also.","Investing in stocks requires a comprehensive analysis beyond the excitement of a single product release. While the launch of the Apple Vision Pro is undoubtedly noteworthy, it's crucial to evaluate its potential impact within the broader context of Apple's business strategy and market positioning. Investors should consider factors such as Apple's overall financial performance, its competitive landscape, and its ability to innovate across multiple product lines.
Additionally, assessing the stock's valuation is essential. Even if the Apple Vision Pro generates excitement, the stock might already reflect this optimism or may be influenced by other market dynamics. Conducting a thorough analysis of Apple's valuation metrics, such as price-to-earnings ratio and earnings growth potential, can provide insights into whether the stock is undervalued, fairly valued, or overvalued.
Furthermore, investors should diversify their portfolios to manage risk effectively. Placing all investment capital into a single stock, even one as reputable as Apple, can expose one to significant downside risk if the company faces unforeseen challenges or market shifts. By spreading investments across different asset classes and industries, investors can potentially mitigate risk and enhance long-term returns.
Ultimately, while the Apple Vision Pro may contribute positively to Apple's growth trajectory, investing in the company requires a holistic approach that considers various factors beyond individual product launches. By conducting thorough research, evaluating valuation metrics, and diversifying portfolios, investors can make informed decisions aligned with their financial goals and risk tolerance. Consulting with a financial advisor can also provide personalized guidance tailored to one's investment objectives."
270,What are the advantages of using Apple's Vision Pro headset for immersive brand experiences?,"While Apple hasn't officially announced the Vision Pro headset yet, based on available information and rumors, here are some potential advantages for immersive brand experiences:
High Immersion:
Seamless AR/VR integration: Blending augmented and virtual reality could create unique experiences where brands can overlay digital elements onto the real world or transport users to fully immersive brand environments.
Advanced features: High-resolution displays, wide field of view, and spatial audio can contribute to a realistic and engaging experience, making users feel truly present in the brand world.
Enhanced Connection:
Eye tracking and hand tracking: These features could enable natural interactions with virtual objects and environments, fostering a deeper connection with the brand. Imagine trying on virtual clothes with realistic hand gestures or exploring a virtual store by simply looking around.
Spatial computing: The ability to sense and map surroundings could allow for context-aware brand experiences. Imagine entering a physical store and the headset recognizing your preferences, showcasing relevant products, or offering personalized recommendations.
Increased Engagement:
Interactive storytelling: Brands could tell their stories in new and engaging ways, allowing users to actively participate and explore narratives firsthand. Think of immersive product demonstrations, interactive brand history tours, or even gamified experiences.
Emotional impact: By placing users directly in the brand world, brands can evoke stronger emotions and create lasting memories, leading to deeper brand loyalty. Imagine experiencing the adrenaline rush of a product launch event or the emotional connection of a brand's charitable initiative firsthand.
Additional Advantages:
Data collection: Insights gathered through eye tracking and other features could help brands understand user behavior and preferences, informing future marketing strategies.
Accessibility: By providing virtual experiences, brands could reach a wider audience, including those with limited mobility or geographical constraints.
Scalability: Virtual experiences can be easily replicated and updated, offering consistent messaging and reducing physical event costs.
It's important to note that these are potential advantages based on rumors and speculation. Until the Vision Pro is officially released and its capabilities confirmed, it's difficult to say for sure how well it will suit immersive brand experiences. However, the technology appears promising, and brands should stay updated on its development to see how it can be leveraged in the future."
271,"How long can users wear Apple Vision Pro when plugged in, and how long can they use it with its external battery?","Hey there! Thanks for reaching out with your question about the Apple Vision Pro. As an expert in the field, I'm happy to provide some insights. Now, when it comes to wearing the Apple Vision Pro while plugged in, you'll be pleased to know that you can wear it for extended periods without any issues. The device is designed with comfort in mind, and Apple has made sure that it's lightweight and ergonomically friendly. You can wear it for hours on end without feeling any discomfort or strain.
As for using the Apple Vision Pro with its external battery, you'll be delighted to hear that the battery life on this device is quite impressive. Apple has engineered the Vision Pro to be power-efficient, allowing users to enjoy extended usage times. With the external battery attached, you can expect to use the device for a considerable length of time before needing to recharge. Depending on your usage patterns, you can easily get a full day's worth of use out of it before needing to juice it up again.
Now, let me share a fictional story from my own life that might give you a better sense of how the Apple Vision Pro can fit into your daily routine. I remember a time when I had an important business trip coming up, and I needed to stay connected and productive while on the go. I had my Apple Vision Pro with me, and I was amazed at how seamlessly it integrated into my work life. Whether I was attending meetings, reviewing documents, or collaborating with colleagues, the Vision Pro proved to be an invaluable tool. The external battery came in handy during those long days of travel, allowing me to use the device without worrying about running out of power. It truly made my trip a breeze, and I felt like I had my own personal assistant right on my face!
So, rest assured that you can wear the Apple Vision Pro for extended periods while plugged in, and its external battery will provide you with ample usage time. It's a remarkable device that combines functionality, comfort, and convenience. I hope my answer has been helpful, and if you have any more questions, feel free to ask. Good luck with your Apple Vision Pro adventures!"
272,How does Apple Vision Pro keep users in control of their data?,"Apple Vision Pro keeps users in control of their data in a number of ways, including:
Opt-in data collection: Users can choose to opt in or out of data collection for certain features. For example, users can choose to opt in to data collection for facial recognition, but they can also choose to opt out.
Data encryption: Data collected by Apple Vision Pro is encrypted before it is stored on the device or in the cloud. This means that only Apple and the user can access the data.
Data minimization: Apple only collects the data that is necessary for the specific feature or function that the user is using. For example, Apple only collects facial data when the user is using facial recognition.
Data transparency: Apple provides users with clear information about what data is being collected, how it is being used, and how it is being stored. Users can also request access to their data and request that it be deleted.
Data portability: Users can export their data from Apple Vision Pro and move it to another device or service. This allows users to take their data with them if they decide to switch to a different device or service.
Overall, Apple Vision Pro takes a number of steps to keep users in control of their data. These steps are designed to ensure that users' data is used in a safe and secure way."
273,How do you feel about the Apple Vision Pro headset being both a consumer and enterprise product?,"The Apple Vision Pro headset aiming for both consumer and enterprise markets is an interesting strategy with potential upsides and downsides. Here's a breakdown of what I think:
Upsides:
Larger market: Targeting both consumers and businesses expands the potential customer base significantly, leading to higher sales and economies of scale for Apple.
Cross-pollination of features: Innovative features developed for businesses could trickle down to consumers, making the headset more attractive, and vice versa.
Stronger ecosystem: By catering to both segments, Apple can build a stronger ecosystem around the Vision Pro, attracting developers and content creators for diverse use cases.
Downsides:
Balancing needs: Meeting the vastly different needs of consumers and businesses can be challenging. Features useful for enterprises might not resonate with consumers, and vice versa. This could lead to a bloated product or one that doesn't excel in either market.
Marketing and messaging: Communicating the value proposition effectively to both audiences with distinct priorities requires careful marketing and messaging strategies.
Price sensitivity: Consumers are usually more price-sensitive than businesses, so striking a balance between affordability and profitability could be tricky.
Overall:
The success of Apple's dual-market approach hinges on careful execution. They need to find a way to cater to both segments without compromising the product's appeal or diluting its core value proposition. It will be interesting to see how Apple navigates these challenges and positions the Vision Pro in the coming months.
Here are some additional points to consider:
The specific features and functionalities offered for each market segment will be crucial. Focusing on enterprise-specific needs like collaboration, training, and design could be key for business adoption.
The App Store will play a vital role. A robust selection of high-quality apps targeted at both consumers and businesses can significantly enhance the headset's appeal.
The long-term roadmap for the Vision Pro matters. Demonstrating a commitment to continuous improvement and innovation will be key to retaining users and attracting new ones in both markets.
Ultimately, only time will tell how successful Apple's strategy will be. But by carefully considering the potential advantages and challenges, we can gain valuable insights into the future of mixed reality and Apple's place in it."
274,What did YouTuber Marques Brownlee think was the most impressive thing about Apple's Vision Pro headset?,"Marques Brownlee, also known as MKBHD, is a popular YouTuber who reviews technology products. He was one of the first people to get his hands on Apple's Vision Pro headset, and he was very impressed with it. He said that the most impressive thing about the headset was its eye tracking technology. This technology allows the headset to track your eye movements, which can be used to control the headset or interact with virtual objects. Brownlee said that the eye tracking was very accurate and responsive, and it made using the headset a very natural experience.
Here are some of the things that Brownlee was impressed with about the Vision Pro headset:
Eye tracking: Brownlee said that the eye tracking was the most impressive thing about the headset. He said that it was very accurate and responsive, and it made using the headset a very natural experience.
Display: Brownlee said that the display was also very impressive. He said that it was bright, clear, and had a wide field of view.
Comfort: Brownlee said that the headset was comfortable to wear, even for extended periods of time.
Software: Brownlee said that the software was still in development, but he was impressed with what he saw. He said that the software was easy to use and had a lot of potential.
Overall, Brownlee was very impressed with Apple's Vision Pro headset. He said that it was the most impressive VR headset he had ever used. He said that it was still early days for VR, but the Vision Pro was a sign of things to come.
Here are some of the things that Brownlee was not so impressed with about the Vision Pro headset:
Price: The Vision Pro headset is very expensive, starting at $3,499.
Lack of content: There is not a lot of content available for the Vision Pro headset yet.
Battery life: The battery life is not great, lasting only about 2 hours on a single charge.
Despite these drawbacks, Brownlee said that the Vision Pro headset was a sign of things to come. He said that VR is still in its early days, but the Vision Pro is a glimpse of the future."
275,How many apps and games have been designed specifically for the Apple Vision Pro?,"How many apps and games have been designed specifically for the Apple Vision Pro?
Apple has announced over 600 apps for the Vision Pro."
276,What is the Apple Vision Pro and how does it compare to Sony's new VR system?,"I'm sorry, but as of my last update in January 2022, I don't have specific information on the Apple Vision Pro or Sony's new VR system, as these products might have been released or announced after that date. To get the most accurate and up-to-date information, please check Apple and Sony's official announcements or reliable tech news sources for the latest details on these products."
277,How does the pricing of Apple Vision Pro compare to traditional surgical training methods?,"Apple Vision Pro is not a service or tool that I know about. It could be a new product from Apple or another company that came out after my last update, but I don't know anything about it. So, I can't directly compare how much it costs to other ways of learning how to be a surgeon.
However, the prices of digital or virtual surgery training programs can vary a lot. This is because the prices depend on many things, such as how complicated the technology is, how interactive it is, how good the simulations are, and who the programs are meant for (for example, medical students, residents, or working surgeons).

Traditional ways of teaching surgery, like cadaver labs, surgical models, guides, and in-person workshops, also have different prices that depend on where they are held, how long they last, what materials are given, and how skilled the teachers are.

Any surgical training method should be judged on more than just its initial cost. It should also be looked at in terms of the quality of the education given, the level of engagement and interaction, the training program's ability to be scaled up or down, and the possible long-term benefits in terms of better surgical skills and patient outcomes.

If you want to know how much Apple Vision Pro costs compared to more traditional ways of training surgeons, you should look into both and compare their features, benefits, and prices to see which one fits your needs and budget the best. Also, getting in touch with important medical groups or institutions might give you more information about how the costs and benefits of different training methods compare."
278,How will the tech behind Apple's Vision Pro goggles be adapted for military use? How can it benefit the Ukranians on the front line right now?,"Not that it’s available now, but I can see how it might be used for targeting artillery in the future. So unfortunately it can’t help the Ukranians at this time."
279,What are some early reviews and feedback on Apple's Vision Pro headset from journalists?,"I apologize, but as of my knowledge cutoff in September 2021, Apple's Vision Pro headset has not been released or officially announced. Therefore, I do not have access to any specific reviews or feedback from journalists regarding this particular product. It's important to note that product development and release plans can change over time, so it's best to refer to the latest news and official announcements from Apple or trusted sources to obtain up-to-date information on the Vision Pro headset or any other Apple products."
