,title,content
371,What are the reasons analysts believe that Apple's Vision Pro headset will have few buyers despite its impressive features?,"However, I can speculate on some potential reasons why analysts might believe the headset could have limited buyers despite its impressive features. These reasons are based on general industry trends and factors that have influenced consumer adoption of new technologies in the past:
1. High price: Apple products are often associated with premium pricing, and if the Vision Pro headset carries a significant price tag, it may limit its appeal to a niche market. Virtual reality (VR) headsets already face price barriers, and if the Vision Pro is considerably more expensive than competing devices, it could deter potential buyers.
2. Limited content ecosystem: The success of VR headsets relies heavily on the availability and quality of content. If Apple's Vision Pro headset does not have a robust content ecosystem at launch or lacks exclusive compelling experiences, it may fail to attract a wide range of consumers who are seeking diverse and engaging VR content.
3. Compatibility and ecosystem limitations: If the Vision Pro headset primarily focuses on Apple's ecosystem and has limited compatibility with other devices or platforms, it may restrict its potential user base. VR enthusiasts often value interoperability and the ability to use their devices across different platforms and applications.
4. Competition from established players: The VR market is already populated by well-established players like Oculus (owned by Facebook), HTC, and Sony, who have gained a significant market share and established a strong presence. Apple may face stiff competition from these companies, and analysts might believe that it could be challenging for Apple to penetrate and disrupt the market.
5. Early adoption challenges: Early iterations of new technologies often face challenges such as limited software support, hardware constraints, or usability issues. If analysts anticipate that Apple's Vision Pro headset could face such challenges initially, it might impact their predictions about its adoption rate.
It's important to note that these reasons are speculative, and the actual market reception and adoption of Apple's Vision Pro headset will depend on various factors, including its pricing, features, content ecosystem, marketing efforts, and consumer preferences. For accurate and up-to-date insights, it would be best to refer to industry reports, analyst opinions, or official announcements from Apple."
372,How does Apple Vision Pro provide a sense of immersion in experiences?,"Apple Vision Pro provides a sense of immersion in experiences through a variety of features, including:
High-resolution displays: The headset's displays provide a high-resolution image that can be seen in sharp detail. This helps to create a sense of realism and immersion.
Spatial audio: The headset's spatial audio system provides surround sound that can be heard from all directions. This helps to create a sense of presence and immersion.
Eye tracking: The headset's eye tracking system allows the headset to track the user's eye movements. This can be used to control the headset's interface and to provide more immersive experiences.
Hand tracking: The headset's hand tracking system allows the headset to track the user's hand movements. This can be used to control the headset's interface and to interact with virtual objects.
Passthrough mode: The headset's passthrough mode allows the user to see the real world through the headset's displays. This can be used to maintain situational awareness and to interact with the real world while using the headset.
These features work together to create a sense of immersion that can be used to enhance a variety of experiences, such as gaming, education, and entertainment.
Here are some specific examples of how Apple Vision Pro can be used to create immersive experiences:
Gaming: Apple Vision Pro can be used to create immersive gaming experiences that feel like the user is actually inside the game world. This can be done by using the headset's high-resolution displays, spatial audio system, and eye tracking system to create a realistic and engaging experience.
Education: Apple Vision Pro can be used to create immersive educational experiences that allow students to learn in new and engaging ways. This can be done by using the headset's high-resolution displays, spatial audio system, and hand tracking system to create interactive and hands-on learning experiences.
Entertainment: Apple Vision Pro can be used to create immersive entertainment experiences that allow users to enjoy movies, TV shows, and other content in a whole new way. This can be done by using the headset's high-resolution displays, spatial audio system, and passthrough mode to create a realistic and immersive experience.
The possibilities are endless. Apple Vision Pro has the potential to revolutionize the way we interact with technology and to create new and immersive experiences in a variety of industries."
373,How does the release of the Quest 3 headset and the planned launch of Apple Vision Pro impact the mixed reality industry?,"The release of the Quest 3 headset and the planned launch of Apple Vision Pro will have a significant impact on the mixed reality industry. Both headsets offer powerful hardware and software features that will make mixed reality more accessible and immersive for consumers.
The Quest 3 is a self-contained headset that doesn't require a PC or smartphone to operate. This makes it a more convenient and portable option for users. The headset also features a high-resolution display, improved tracking, and a longer battery life than its predecessor.
Apple Vision Pro is expected to be a more premium headset than the Quest 3. It is rumored to have a higher-resolution display, more powerful processors, and better eye tracking. The headset is also expected to be compatible with Apple's entire ecosystem of devices, making it a more seamless experience for users."
374,What role does the Light Seal play in the overall functionality of Apple Vision Pro?,"The Light Seal in Apple Vision Pro plays an important role in the overall functionality of the headset. It helps to block out stray light from the outside, which can interfere with the headset's sensors and cause image quality issues.
The Light Seal is made of a flexible, 3D-knitted material that is designed to conform to the user's face and create a tight seal around the headset's displays. This helps to block out stray light from all directions, including from above, below, and around the edges of the headset.
The Light Seal is also important for maintaining the headset's thermal performance. By blocking out stray light, the Light Seal helps to keep the headset's displays cooler, which can help to prevent them from overheating.
Overall, the Light Seal is an important part of Apple Vision Pro that helps to ensure the headset's overall functionality. Without the Light Seal, the headset's sensors would be more susceptible to interference from stray light, which could lead to image quality issues and other problems.
Here are some of the benefits of the Light Seal in Apple Vision Pro:
Improved image quality: The Light Seal helps to block out stray light, which can improve the image quality of the headset's displays. This is especially important for tasks such as VR gaming and video editing, where accurate color reproduction is critical.
Reduced eye strain: The Light Seal can help to reduce eye strain by blocking out stray light. This is because stray light can cause the pupils to dilate, which can lead to eye fatigue.
Improved thermal performance: The Light Seal helps to keep the headset's displays cooler, which can help to prevent them from overheating. This is important for extended use, as overheating can lead to performance issues and even damage to the headset.
Increased comfort: The Light Seal helps to create a more comfortable fit for the headset. This is because it helps to block out stray light and prevent the headset from being too loose.
Overall, the Light Seal is an important part of Apple Vision Pro that helps to improve the headset's overall functionality. It can improve image quality, reduce eye strain, improve thermal performance, and increase comfort."
375,Why does Mark Zuckerberg like Meta's Quest 3 even though he thinks Apple's Vision Pro is a better entertainment device?,"Not many people want to drop 3,500$ on vr goggles. I’m sure the apple product is superior but it’s also 6X the cost of the quest 3. I’ll like the apple from afar until it becomes affordable for those not sitting on bags of money."
376,"What is Apple Vision Pro, and how does it work?","It will next year be a face mounted computer with M2 SoC, capable of augmented reality and virtual reality and can run existing software. You can read about it at Apple’s web site."
377,"What are some limitations or drawbacks of using virtual reality headsets like Apple's Vision Pro, particularly in social settings?","I wouldn’t say a limitation, but those virtual reality headsets in my opinion are only a fad. There is holographic interfaces and holographic gaming that’s being developed."
378,What are some potential implications of the high price tag on the adoption of Apple's Vision Pro headset?,"High Price tag will impact general user adoption of Apple vision pro
It is not for mass users as iPhone is in its current state.
High tech, best user experience and slow adoption is Apple’s strategy since the beginning.
This will also give enough time to competitors to bring in Apple Vision Pro to there cheaper VR devices and gain more users. It will be a loss for Apple but based on there experiences for so many devices in the past with same strategy they might be ok for this trade-off."
379,"What are some examples of large brands and enterprise retailers that have already showcased the potential of mixed reality technologies like Apple's Vision Pro, according to John Shapiro?","I couldn't find specific information or references to John Shapiro discussing Apple's ""Vision Pro"" or its mixed reality technologies. However, I can provide examples of large brands and enterprise retailers that have showcased the potential of mixed reality technologies in general:
IKEA: IKEA has implemented augmented reality (AR) technology in its IKEA Place app, allowing customers to visualize how furniture will look and fit in their homes before making a purchase.
Lowe's: Lowe's introduced the Lowe's Vision app, which uses AR to help customers visualize home improvement projects and products in their own spaces.
Sephora: Sephora's Virtual Artist app uses AR to enable customers to virtually try on makeup products and experiment with different looks before purchasing.
Mercedes-Benz: Mercedes-Benz has incorporated AR technology into its ""Ask Mercedes"" app, which provides users with interactive vehicle manuals and guides using augmented reality.
Walmart: Walmart has experimented with VR training programs for employees to simulate real-world scenarios and improve customer service skills.
Ford: Ford has used VR technology to create virtual showrooms and experiences for customers to explore and customize vehicles before visiting a dealership.
These examples demonstrate how large brands and enterprise retailers have leveraged mixed reality technologies, such as augmented reality (AR) and virtual reality (VR), to enhance customer experiences, improve product visualization, and streamline operations. However, it's important to note that the specific technologies and implementations may vary, and I couldn't find direct references to John Shapiro discussing Apple's ""Vision Pro"" or its mixed reality technologies."
380,Is the Apple Vision Pro a device that will strongly focus on Apple's AI integration into their iPhones?,Nope. But it aims to replace the iphones and macs
381,What are your thoughts on the Apple Vision Pro headset?,"Let’s talk about the rumored Apple Vision Pro headset and its potential impact on the market.
The Apple Vision Pro headset is an innovational product from Apple, combining augmented reality (AR) and virtual reality (VR) technologies. After the official confirmation from Apple regarding the headset's existence or features, several reports include:
1. High-resolution displays: The headset could feature high-quality displays for a more immersive AR/VR experience.
2. Advanced tracking capabilities: The device might be equipped with sophisticated sensors and cameras to track users' movements accurately.
3. Powerful processors: It is expected that the headset will include powerful processors to support complex AR/VR applications and experiences.
4. Sleek design: As with most Apple products, the Vision Pro headset may have a sleek and stylish design that appeals to a wide range of consumers.
5. Integration with Apple ecosystem: The headset could potentially integrate seamlessly with other Apple devices and s..."
382,Would you use the Apple Vision Pro and the new Zoom app for your work meetings or personal calls?,"As of my last knowledge update in January 2022, I don't have specific information about the ""Apple Vision Pro"" or any updates on the ""new Zoom app."" However, the decision to use them for work meetings or personal calls would depend on factors such as their features, compatibility with your needs, and user preferences. It's advisable to consider reviews and the latest information on these products to make an informed decision based on your requirements."
383,What are some other industries or markets that could benefit from using high-end VR headsets like Apple Vision Pro?,"High-end VR headsets like Apple Vision Pro can have applications across various industries and markets. Here are some examples:
Gaming and Entertainment: VR has already made significant strides in gaming and entertainment. High-end headsets can offer immersive and realistic gaming experiences, allowing users to interact with virtual environments and characters in unprecedented ways.
Architecture and Real Estate: VR can revolutionize the way architects, designers, and real estate agents showcase their projects. With high-end headsets, clients can virtually tour properties, explore architectural designs, and visualize interior spaces before they are built.
Healthcare: VR has shown great potential in healthcare, enabling medical training, therapy, pain management, and rehabilitation. High-quality VR headsets can enhance the realism and effectiveness of simulations, allowing medical professionals to practice procedures and learn in a safe and controlled environment.
Education and Training: VR can transform education by providing immersive and interactive learning experiences. High-end headsets can enable students to explore historical sites, travel through space, or conduct virtual experiments, enhancing engagement and knowledge retention.
Manufacturing and Design: VR can streamline the design and manufacturing processes by offering virtual prototyping and simulations. High-quality headsets enable engineers and designers to visualize and test product designs, identify potential issues, and make necessary adjustments before physical production .
Tourism and Hospitality: VR can offer virtual travel experiences and help promote tourist destinations. High-end headsets can provide users with a realistic sense of being in a different location, encouraging them to explore and plan their visits."
384,How does using a mixed-reality headset like Apple's Vision Pro change our perception of reality and our surroundings?,"Mixed-reality headsets like Apple's Vision Pro can change our perception of reality and our surroundings by overlaying digital information onto the physical world around us. This digital information can include virtual objects, text, images, and even interactive experiences.
By wearing a mixed-reality headset, users are able to see both the physical world around them and the digital content overlaid on top of it. This can create a sense of immersion and interactivity that is not possible with traditional screens or displays.
For example, a user wearing a mixed-reality headset could see a virtual object overlaid onto a real-world object, such as a virtual ball bouncing off a real-world table. They could also interact with virtual objects using hand gestures or other input methods, creating a more natural and intuitive experience.
Mixed-reality headsets like Apple's Vision Pro have the potential to dramatically change how we interact with and perceive the world around us, blurring the line between the physical and digital realms."
385,What are your thoughts on Apple's announcement of the Apple Vision Pro headset and spatial computing during WWDC 2023?,"I apologize, but as an AI language model, I don't have access to real-time or future events such as Apple's announcements at WWDC 2023. I recommend checking reliable news sources or Apple's official announcements for the most up-to-date information and insights on the Apple Vision Pro headset and spatial computing."
386,How do you think Apple's Vision Pro compares to Meta's Quest devices in terms of functionality and user experience?,"Apple's Vision Pro and Meta's Quest Pro devices share similar objectives, aiming to provide engaging mixed reality experiences that blend virtual worlds with physical environments. With the growing prevalence of remote work, both companies strive to facilitate collaboration and connectivity without requiring individuals to leave their homes. Notably, the key differentiators between these devices lie in graphics resolutions, processing power, performance, and pricing. Additionally, both Pro devices face the challenge of delivering valuable applications that justify their price and the potential discomfort of wearing a device for extended periods, particularly during eight-hour workdays."
387,What do you think of Apple Vision Pro's Environments feature?,"As of my last knowledge update in January 2022, I don't have specific information about an Apple Vision Pro feature called ""Environments."" It's possible that this is a new feature introduced after my last update, or it might be a feature under a different name. Apple regularly updates its software and introduces new features, so it's a good idea to check the latest documentation, release notes, or announcements from Apple for the most accurate and up-to-date information on the features of Apple Vision Pro. If you have specific details or if this is a feature introduced after my last update, I recommend checking Apple's official documentation or news sources for insights and reviews on the Environments feature."
388,How might the decision to include or exclude the top strap affect consumer perception of the Apple Vision Pro's value proposition?,"There is no top strap, there is a back strap to hold the Vision Pro to ones face, somewhat tightly to avoid light leaks. I can see this as a customization opportunity for companies to come out with different colors and patterns."
389,Do you think Apple's Vision Pro mixed reality headset will have limited success like VR devices from Meta Platforms and Pico?,"Though it can be challenging to anticipate the market, Apple's Vision Pro mixed reality headset might have a unique advantage. This stems from its integration with the Apple ecosystem and its emphasis on providing smooth and effortless user experiences.
Apple's history of blending innovation with user-friendly design could potentially distinguish it from competitors. Nevertheless, the achievement of this device will rely on various factors such as the availability of content, pricing considerations, and how quickly users embrace the technology.
As an individual deeply involved in 3D modeling, you may discover promising prospects in crafting immersive content for these platforms. By doing so, you can contribute to their long-term triumph."
390,"What is Black Mirror's ""Striking Vipers"" episode and how does it relate to Apple's Vision Pro?","“Striking Vipers” starts with college sweethearts Danny (Anthony Mackie) and Theo (Nicole Beharie), and their roommate Karl (Yahya Abdul-Mateen II). Years later, Danny and Theo are married, and Karl makes a sporadic reappearance in their lives to gift his old bestie the video game Striking Vipers for his birthday. The Absolute."
391,What is the best thing about Apple Vision Pro?,"The revolutionary visionOS features a brand-new three-dimensional interface that users can magically control with their eyes, hands, and voice. Apple Vision Pro also features EyeSight, an extraordinary innovation that helps users stay connected with those around them."
392,How do you think Apple's Vision Pro headset will change the way we interact with 3D digital spaces and objects?,"I don’t think it’s going to change anything for me. I’ve got nothing against headsets, and think they deliver the most immersive and intense 3D experience there is.
But, I think I’m like most people, and VR headsets are not going to change the way we interact with anything real or digital. I’ll spend a couple thousand bucks on a drone, a few hundred on FPV goggles, but am not going to spend a couple thousand on a headset to wear at my desk.
I’m not expecting Meta or Apple’s AR to make much difference in the way ‘we’ interact with anything."
393,How can users interact with UI elements on Apple's Vision Pro headset?,"As of my knowledge cutoff in September 2021, Apple had not yet released the Vision Pro headset, and there were no official details available regarding its specific user interface or interaction methods. Therefore, I cannot provide precise information about how users can interact with UI elements on that particular headset.
However, based on Apple's existing products and technologies, it is possible to speculate on potential interaction methods that could be employed in the Vision Pro headset. Apple has a history of using intuitive and user-friendly interfaces in their devices. They often integrate a combination of touch, gestures, voice commands, and sensors to enable user interaction.
Considering the nature of a headset and its expected virtual or augmented reality capabilities, it's likely that the Vision Pro headset may offer a combination of gaze-based interaction, head movements, voice commands, and possibly hand gestures or physical controllers. These methods could allow users to navigate menus, select options, interact with virtual objects, or perform actions within the headset's user interface.
However, to obtain accurate information about the specific interaction methods of the Vision Pro headset, it would be best to refer to official announcements, product documentation, or user guides provided by Apple after my knowledge cutoff date."
394,"What are the key features and capabilities of the Apple Vision Pro - Mixed reality Advanced VR Headset - 256GB, and how does it compare to other VR headsets on the market?","In the vast digital desert of technology, there's a shining oasis known as the Apple Vision Pro - Mixed Reality Advanced VR Headset - 256GB. This magical gadget isn't just a pair of fancy glasses; it's like stepping into a whole new universe without even leaving your room!
Imagine wearing a super-secret agent's eyewear, except instead of spying on bad guys, you're exploring far-off lands, playing games with virtual friends, or even attending classes in a virtual classroom. It's like having a genie granting your wishes, but instead of three, you've got countless wishes at your fingertips!
Now, let's talk about its superpowers. With 256GB of storage, it's like having a humongous treasure chest to store all your favourite games, videos, and apps. And the display? It's like looking through a window into another world, with super crisp images that make you feel like you're actually there!
But wait, there's more! The Apple Vision Pro isn't just about visuals; it's got ears too! Well, not literal ears, but super fancy audio that makes you feel like you're surrounded by sound. So, if you're playing a game and a dragon roars behind you, you'll swear it's right there breathing down your neck!
Now, let's compare it to other VR headsets out there. Think of them like different flavours of ice cream. While some headsets might offer cool features like hand-tracking or eye-tracking sprinkles, the Apple Vision Pro is like the ultimate sundae with all the toppings. It's got the best of everything – from stunning visuals to mind-blowing audio – packed into one sleek package.
So, if you're ready to embark on an epic adventure without ever leaving your room, the Apple Vision Pro is your magic carpet ride to a whole new world of virtual wonder!
Digital Dynamo Den
Mordor Intelligence
,
Sheikh Abdullah
,
Md. Nadim Ansari
and 10 more are contributors"
