sentence,features
Augmented Reality (AR) Assistance**: AR features could provide helpful information and guidance for users with vision or navigation difficulties.,AR/VR
"Apple Vision Pro is a high-end mixed reality headset that features a number of advanced technologies, including:
Micro-OLED displays: The headset features two micro-OLED displays, each with a resolution of 1920 x 1080 pixels.",headset
"Micro-OLED displays are known for their high contrast ratio and wide color gamut, which can provide a more immersive viewing experience.",headset
"R1 chip: The headset is powered by the R1 chip, which is a custom-designed chip from Apple.",headset
The R1 chip is designed to handle the demanding tasks of rendering 3D graphics and processing spatial audio.,headset
Spatial audio: The headset features a built-in spatial audio system that can create a surround sound experience.,headset
"This system uses a number of sensors to track the user's head movements and position, and then adjusts the sound accordingly.",headset
"Eye tracking: The headset also features eye tracking technology, which can be used to track the user's gaze.",headset
"This technology can be used for a variety of purposes, such as controlling the headset's interface or providing more immersive experiences.",headset
"Passthrough mode: The headset also features a passthrough mode, which allows the user to see the real world through the headset's displays.",headset
This mode can be used for safety or to interact with the physical world.,headset
"Hand tracking: The headset also features hand tracking technology, which can be used to control the headset's interface or interact with virtual objects.",headset
These are just a few of the advanced technologies integrated into Apple Vision Pro.,headset
These technologies can be used to create a more immersive and interactive mixed reality experience.,headset
"Apple calls the Vision Pro ""the most advanced personal electronics device ever"" and it's the company's first novel platform since the Apple Watch came out in 2015.",general
You can use it to call friends or host meetings; play games or watch movies; record events in real-time; or simply cast apps on your physical surroundings.,general
"No need for a remote Äî you control it with your eyes, hands and voice.",general
"""Unlike the rest of the headsets on the market, Apple's Vision Pro isn't a virtual-reality device designed to convince consumers to ditch the real world for the Metaverse.",general
"Instead, Apple's built an augmented-reality headset it believes will be the future of personal computing and entertainment.",general
Apple Vision Pro is like the Macbook.,general
"They want people to use Vision Pro with Apple apps, and bluetooth or 5g connected tools/products to Vision Pro.",general
Vision Pro is a universal mixed reality platform that you can connect everything to it(apps peripheral).,general
Much like a Macbook.,general
"So, a designer could design a product and perhaps 3d print the 3d shape, and the software on Vision Pro will superimpose the graphic design to it, and you can also immediately show their prototypes to anyone wearing a Vision Pro.",general
"The overall strategy for Apple is to specialize in computing devices, audio and video.",general
"They also use that specialization for making the platform(all purpose devices) which connects apps, wireless(and wired) products to the devices.",general
"Apple does do things like making peripheral products, but their big focus is that primary hub which all peripheral product connects into.",general
"By having the best primary hub they can win a lot of sales, but also get people to buy their peripheral products which integrates more flawlessly.",general
The introduction of Apple's Vision Pro has the potential to propel virtual and augmented reality devices into the enterprise mainstream.,general
"Its user-friendly design and Apple's strong market influence may drive increased adoption of professional applications, making immersive experiences more accessible for businesses and professionals alike.",general
Apple's Vision Pro headset is a highly anticipated product that has been making waves in the tech community.,technology
"This revolutionary headset is said to combine augmented reality and virtual reality capabilities, providing users with an immersive and interactive experience.",technology
"The headset is rumored to have advanced eye-tracking technology, allowing for a more natural and intuitive interaction with virtual objects.",technology
"Additionally, it is said to have a high-resolution display and powerful processors, making it a top-of-the-line device.",technology
"If you want to learn more about Apple's Vision Pro headset and stay updated on its release, be sure to check out the link in our bio.",technology
You won't want to miss out on this groundbreaking technology!,technology
Sure.,AR/VR
The M2 chip in Apple Vision Pro has a 10-core GPU that can deliver up to 35% faster graphics performance than the M1 chip.,AR/VR
This means that Apple Vision Pro can be used to power immersive gaming experiences and other graphics-intensive tasks.,AR/VR
I'm not expecting much in the way of gaming on Vision Pro for the next few years.,general
"The Apple Vision Pro is expected to come at a premium price, likely exceeding the current high-end VR headsets.",price
The Apple Vision Pro is a high-end headset with a hefty price tag and cutting-edge technology.,price
It's like the luxury car of the virtual reality world.,vision
"With its powerful chips and 4K resolution per eye, it aims to provide users with a top-notch immersive experience.",vision
"So, when it comes to innovation, the Apple Vision Pro shines with its cutting-edge technology and advanced features, setting a new standard for immersive experiences.",technology
"If Apple's Vision Pro headset offers unique and compelling features that meet customer needs, it has the potential to contribute positively to the company's sales.",general
Apple's strong brand and customer loyalty can also play a significant role.,general
"However, predicting the exact impact on sales requires observing market dynamics and consumer reactions over time.",general
Apple is renowned for its sleek and intuitive user interfaces across its devices.,technology
"Their operating system, iOS, offers a clean and visually appealing interface with easy navigation and intuitive gestures.",technology
"Apple's interface design focuses on simplicity, consistency, and seamless integration between apps and features.",technology
"The overall experience aims to be user-friendly, allowing users to quickly and efficiently navigate through different functionalities.",technology
"It is difficult to say for sure how likely it is that Apple's Vision Pro headset will establish ""spatial computing"".",headset
"However, Apple has a strong track record of introducing new technologies that become mainstream, and the Vision Pro headset has the potential to be a major breakthrough.",technology
"AR and VR headsets are still relatively expensive, which could limit their appeal to the mass market.",price
"There is not yet a wide selection of AR and VR applications available, which could make it difficult for people to justify the purchase of a headset.",AR/VR
Apple Vision Pro is a powerful technology framework developed by Apple that encompasses a range of features and capabilities related to computer vision and image processing.,technology
It is designed to enable developers to integrate advanced vision capabilities into their applications.,technology
Apple Vision Pro allows for accurate and efficient object detection in images and videos.,vision
Apple Vision Pro offers robust text recognition capabilities.,technology
Apple Vision Pro includes built-in support for barcode and QR code detection.,technology
"Overall, Apple Vision Pro offers developers a comprehensive set of features and capabilities to enhance their applications with advanced computer vision functionality.",general
"From object detection and image recognition to text extraction and AR integration, this framework empowers developers to create innovative and engaging visual experiences.",general
There isnt any one particular app because this is a whole new device that Apple had put out.,general
Their mixed reality headset is very interesting.,general
I would definitely book a demo session to experience Apple's Vision Pro headset.,headset
This cutting-edge device represents a significant advancement in immersive technology and offers a unique opportunity to explore its features and capabilities firsthand.,headset
"By booking a demo, I gain direct access to the Vision Pro headset's innovative features and functionalities.",experience
"From its exceptional visual quality and seamless integration with Apple's ecosystem to its intuitive controls and immersive user interface, experiencing the headset in person will provide valuable insights into its potential applications and benefits.",experience
"Watching online videos is good, but I find scheduling a demo is an excellent way to get an up-close look at what the Vision Pro headset has to offer.",experience
"Following a plethora of complaints, including headaches and eyesight issues, owners of the Apple eyesight Pro are returning it to the Apple store.",vision
"Apple stated in a disclaimer that using the Vision Pro headset could ""increase your risk of injury or discomfort"" and aggravate some pre-existing medical conditions.",headset
"Headaches, vertigo, eye problems, inner ear pain, seizures, skin problems, and more were among these problems.",headset
"Smartphones are changing the brains of our children, and schools are not equipped to meet their needs.",general
Vision Pro technology may be the answer.,general
"But if you use the technology to teach them, then you should use the same technology to test them.",general
"If Vision Pro technology becomes standard for white collar workers, then students will be better prepared.",general
"The headset sits close to your face, and the pressure exerted on the bridge of your nose and cheekbones could cause discomfort if wearing contact lenses.",headset
"The headset's eye-tracking sensors might be affected by the thickness and curvature of contact lenses, potentially impacting the accuracy of features like gaze control.",vision
"Regularly removing and inserting contact lenses while wearing the headset could expose your eyes to dust, debris, or bacteria, further increasing the risk of irritation or infection.",vision
Apple's entry into the immersive headset market with the Vision Pro has the potential to influence the virtual reality industry.,general
Apple's involvement often brings attention and innovation to a market segment.,general
"The success of the Vision Pro in kick-starting the virtual reality industry would depend on factors such as the headset's features, user experience, and its ability to appeal to a broad audience.",general
"While Apple has a significant influence, the overall growth and success of the virtual reality industry will also be shaped by developments from other companies, advancements in technology, content creation, and wider adoption by consumers and businesses.",general
"It's an evolving landscape, and the impact of Apple's Vision Pro will become clearer as the product is released and gains market traction.",general
Apple often emphasizes innovation and advanced technology in its products.,technology
"If this statement is accurate, it suggests a combination of cutting-edge features, design, and performance that set it apart in the consumer electronics landscape.",technology
The Vision Pro uses machine learning to anticipate the user and to simplify the input process as well as recognize the user's eyes,technology
What functions does the M2 chip perform in Apple Vision Pro?,technology
"Do you think YouTube, Spotify, and Netflix will eventually support Apple Vision Pro?",technology
What transformative effects does Apple Vision Pro promise for the digital landscape?,technology
Will something like the Apple Vision Pro enable me to replace the mouse entirely with hand movements?,technology
What other industries besides film could be transformed by technology like Apple's Vision Pro headset?,technology
What impact do you think Apple's Vision Pro with EyeSight technology will have on the future of virtual and augmented reality?,technology
Machine Learning has been in your iPhone and iPads for a long time now.,technology
Apple will announce some new ways it is engaging machine learning into its operating systems across all devices.,technology
TheyÄôll have a lot of focus on privacy and control of your data.,technology
The Vision Pro uses machine learning to anticipate the user and to simplify the input process as well as recognize the userÄôs eyes.,technology
Machine learning is all about sensors and other inputs where the operating system can sometimes anticipate what is needed next.,technology
"As much as you might be seeing people talking about Artificial Intelligence, thereÄôs no such thing yet.",technology
"General Artificial Intelligence is still a long way off, but localized and task specific machine learning has been around since about 2000.",technology
"The M2 chip in Apple Vision Pro performs the following functions:
Rendering 3D graphics
Processing spatial audio
Tracking the user's head movements
Tracking the user's eye movements
Detecting objects in the real world
Processing hand gestures
The M2 chip is a custom-designed chip from Apple that is designed to power the demanding tasks required for a mixed reality headset.",technology
"Market Adoption: If Apple Vision Pro gains popularity and a significant user base, content providers like YouTube, Spotify, and Netflix may consider supporting it to reach a broader audience.",technology
Technical Compatibility: Support would depend on whether Apple Vision Pro aligns with industry standards and technical requirements for streaming services.,technology
"If it does, integration becomes more likely.",technology
Partnerships and Agreements: Collaboration and agreements between Apple and content providers can influence support.,technology
"If there are partnerships or licensing agreements in place, it could facilitate support for Apple Vision Pro.",technology
"In the ever-evolving landscape of technology, Apple continues to push boundaries with innovations that shape the way we interact with the world.",technology
"The latest addition to their arsenal, Apple Vision Pro, has garnered attention for its cutting-edge features and capabilities.",technology
"Some new technology, such as Apple Vision does appeal to mostly the younger generations.",general
"The question might be, how will this effect peoples lives in the future?",general
Much new technology is providing a means of escaping reality.,general
"We we look an the state of younger generations today, we donÄôt see psychologically more stable people.",general
"Vision Pro is claimed to be positioned to replace one's daily computer, which is interesting considering it only has a 2 hour battery life - is Apple looking to make additional batteries a must have and like all Apple products premium priced?",price
"As of my knowledge cutoff in September 2021, Apple has not released detailed information about the specific neural network architecture used in their Vision Pro headset for face scanning.",headset
"The details of the advanced encoder-decoder neural network, if utilized by Apple, have not been publicly disclosed.",headset
"Apple typically keeps specific technical details and proprietary information closely guarded, including the internal workings of their neural network models.",technology
"Therefore, without any official announcements or documentation from Apple regarding the architecture used in their Vision Pro headset, it is challenging to provide specific information about the neural network utilized for face scanning.",technology
"It's worth noting that neural networks commonly used for face-related tasks include convolutional neural networks (CNNs), recurrent neural networks (RNNs), and more advanced variants like the U-Net or the Transformer network.",technology
"However, without explicit information from Apple, any discussion of the neural network architecture in the Vision Pro headset would be speculative.",technology
The Apple Vision Pro headset represents an anticipated entry for Apple into the augmented reality (AR) market.,AR/VR
"While details about the product were limited at that time, Apple's involvement in AR technology has generated significant interest.",AR/VR
"Businesses might explore ways to use the Apple Vision Pro for virtual meetings, collaborative design sessions, and remote assistance.Industries that require hands-on training, such as healthcare, aviation, and maintenance, may find AR valuable for creating realistic simulations.",technology
"The Apple Vision Pro could play a role in enhancing training programs.AR headsets can assist technicians in the field by providing real-time information, schematics, and troubleshooting guidance.",technology
"This could improve efficiency in maintenance and repairs.Apple's AR headset could offer innovative ways for businesses to engage customers, such as virtual try-on experiences for products, interactive advertisements, and immersive brand experiences.AR can enhance navigation and wayfinding in complex environments.",technology
"Industries like logistics, construction, and warehousing may find applications for improved spatial awareness and guidance.It's important to note that the success and impact of the Apple Vision Pro headset in enterprise applications will depend on factors such as adoption, development of compatible software, and user acceptance.",technology
"As the technology evolves and more information becomes available, businesses will have a clearer understanding of the opportunities that arise from Apple's foray into augmented reality.",technology
"Market Expansion for Omniverse: Being featured as a key application on a high-profile device like the Apple Vision Pro could introduce Omniverse to a broader audience, including consumers, developers, and businesses.",technology
Competitive Advantage for Apple: Having a compelling application like Omniverse as a key feature of the Apple Vision Pro could give Apple a competitive advantage in the AR headset market.,AR/VR
It could differentiate the device from competitors and attract users by offering innovative and immersive experiences powered by Omniverse.,AR/VR
So he dons a vision pro headset and has the 3D MRI image sitting in front of him as well as the realtime feed from the operating microscope.,headset
"Yes, you can control the level of immersion in Apple Vision Pro using a variety of settings, including:
Passthrough mode: Passthrough mode allows you to see the real world through the headset's displays.",headset
This can be used to maintain situational awareness and to interact with the real world while using the headset.,headset
You can toggle passthrough mode on or off using a button on the headset or by using a gesture.,headset
Depth of field: Depth of field controls how much of the real world is visible through the headset's displays.,headset
"A shallow depth of field will make the real world appear blurry, while a deep depth of field will make the real world appear sharp.",headset
You can adjust the depth of field using a slider in the headset's settings.,headset
Head tracking: Head tracking controls how the headset's displays track your head movements.,headset
"A high head tracking sensitivity will make the headset's displays move quickly with your head movements, while a low head tracking sensitivity will make the headset's displays move more slowly with your head movements.",headset
You can adjust the head tracking sensitivity using a slider in the headset's settings.,headset
Eye tracking: Eye tracking controls how the headset's interface responds to your eye movements.,headset
"A high eye tracking sensitivity will make the headset's interface respond quickly to your eye movements, while a low eye tracking sensitivity will make the headset's interface respond more slowly to your eye movements.",headset
You can adjust the eye tracking sensitivity using a slider in the headset's settings.,headset
Hand tracking: Hand tracking controls how the headset's interface responds to your hand movements.,headset
"A high hand tracking sensitivity will make the headset's interface respond quickly to your hand movements, while a low hand tracking sensitivity will make the headset's interface respond more slowly to your hand movements.",headset
You can adjust the hand tracking sensitivity using a slider in the headset's settings.,headset
These settings allow you to customize the level of immersion that you experience in Apple Vision Pro.,headset
You can adjust the settings to find the level of immersion that works best for you and for the experience that you are using the headset for.,headset
"For example, if you are using Apple Vision Pro for gaming, you may want to increase the head tracking sensitivity and the eye tracking sensitivity.",headset
This will make the game world feel more immersive and will allow you to interact with the game world more easily.,headset
"If you are using Apple Vision Pro for education, you may want to decrease the depth of field.",headset
This will make the real world appear less blurry and will allow you to see more of your surroundings.,headset
The possibilities are endless.,headset
You can experiment with the different settings to find the level of immersion that works best for you.,headset
"Apart from driving, people have been spotted wearing Apple's Vision Pro while exercising, working, and even attending events.",technology
"The advanced technology of the Vision Pro allows users to seamlessly incorporate it into their daily activities, making it a versatile and convenient accessory.",technology
Apple Vision Pro is a AR headset (no matter how much Apple wants everyone to call it a Äú spatial computing deviceÄù).,headset
"Some people who use them are jackasses because a lot of people are jackasses, so anytime you have a random portion of the population use a thing a bunch will be jackasses.",headset
"AR headsets, a specific car brand, blue shirts, pocket watches, plastic utensils.",headset
"People also get bored so they like news about new things, and Äúsome jackass does something dumb with a thing you probably have not seen in person or gotten tired of hearing aboutÄù sells well, or attracts eyeballs to advertisements.",headset
So you get extra coverage of jackasses.,headset
Also social media letting people share in advertising revenue on media they create means people are getting paid to be jackasses.,headset
"So not only do we have the more traditional jackasses by incompetence, jackasses by accident, and jackasses by inclination, we now also get to enjoy professional (and aspiring professional) jackasses.",headset
ÄúOh a new thing! What sort of stupidity can I commit with it that a lot of people will watch?Äù,headset
Unity is currently working with Apple to develop a chatbot for their Vision Pro headset.,technology
Unity - a game engine company - has implemented its facial recognition technology into the Vision Pro's camera.,technology
"Do you think Apple's Vision Pro headset will be Apple's next big hit after the smartwatch?I own 2 Apple Watches, 2 iMacs, a MacBook Air (M1 chip), 2 iPhone 14 Pro models, iPad 13Äù with M1 chip, 2 HomePods, etc.",headset
"in short, I love Apple products; however, I do not anticipate more than a market max of 10,000 purchasers (probably 5,000).",headset
"That is NOT a big hit! Purchases are mainly cost benefit decisions, and the price will have to be reduced by 50% for a market to develop($1,500 would be optimum) Äî IMHO.",headset
"Desktop computers, notebook computers, tablets, may be used/enjoyed by two or more folks simultaneously.",headset
The Vision Pro is a 1 user at a time device.,headset
I do not believe families are going to purchase 2 Vision Pro devices.,headset
Why do you think YouTube and Spotify do not plan to support Apple Vision Pro?,technology
I don't have specific information regarding Apple Vision Pro and its compatibility with platforms like YouTube and Spotify.,technology
"It's important to note that developments in the tech industry, including platform support, partnerships, and integrations, can change over time.",technology
"If there is a lack of support for Apple Vision Pro on YouTube and Spotify, potential reasons could include:
Technical Considerations: Apple Vision Pro might have specific technical requirements or features that are not easily integrated with the existing infrastructure of YouTube and Spotify.",technology
"Platform Policies: Each platform may have its policies, guidelines, and technical specifications for integration.",technology
"If Apple Vision Pro doesn't align with these requirements, it could impact support.",technology
"Business Decisions: The decision to support a new technology or platform can be influenced by business strategies, partnerships, and market considerations.",technology
Companies may prioritize supporting platforms that align with their business goals.,technology
Negotiations and Agreements: Integrating with a new platform often involves negotiations and agreements between companies.,technology
"If there are challenges or disagreements in these negotiations, it can affect support.",technology
"User Demand: If there is not enough user demand or if supporting Apple Vision Pro is not seen as a priority by the platforms, they may choose to allocate resources to other features or improvements.",technology
